-- name: test_partial_update
show backends;
CREATE table tab1 (
      k1 INTEGER,
      k2 VARCHAR(50),
      v1 INTEGER,
      v2 INTEGER,
      v3 INTEGER,
      v4 varchar(50),
      v5 varchar(50)
)
ENGINE=OLAP
PRIMARY KEY(`k1`,`k2`)
DISTRIBUTED BY HASH(`k1`) BUCKETS 10
PROPERTIES (
    "replication_num" = "1"
);
-- result:
-- !result
CREATE table tab2 (
      k1 INTEGER,
      v1 INTEGER,
      v2 INTEGER,
      v3 INTEGER
)
ENGINE=OLAP
PRIMARY KEY(`k1`)
DISTRIBUTED BY HASH(`k1`) BUCKETS 10
PROPERTIES (
    "replication_num" = "1"
);
-- result:
-- !result
insert into tab1 values (100, "k2_100", 100, 100, 100, "v4_100", "v5_100");
-- result:
-- !result
insert into tab1 values (200, "k2_200", 200, 200, 200, "v4_200", "v5_200");
-- result:
-- !result
insert into tab1 values (300, "k3_300", 300, 300, 300, "v4_300", "v5_300");
-- result:
-- !result
select * from tab1;
-- result:
100	k2_100	100	100	100	v4_100	v5_100
300	k3_300	300	300	300	v4_300	v5_300
200	k2_200	200	200	200	v4_200	v5_200
-- !result
insert into tab2 values (100, 100, 100, 100);
-- result:
-- !result
insert into tab2 values (200, 200, 200, 200);
-- result:
-- !result
insert into tab2 values (300, 300, 300, 300);
-- result:
-- !result
select * from tab2;
-- result:
100	100	100	100
300	300	300	300
200	200	200	200
-- !result
update tab1 set v1 = (select sum(tab2.v1) from tab2), v2 = (select sum(tab2.v2) from tab2), v3 = 1000;
-- result:
E: (1064, 'Getting analyzing error. Detail message: must specify where clause to prevent full table update.')
-- !result
select * from tab1;
-- result:
100	k2_100	100	100	100	v4_100	v5_100
300	k3_300	300	300	300	v4_300	v5_300
200	k2_200	200	200	200	v4_200	v5_200
-- !result
update tab1 set v1 = (select sum(tab2.v1) from tab2), v2 = (select sum(tab2.v2) from tab2) where k1 = 100;
-- result:
-- !result
select * from tab1;
-- result:
100	k2_100	600	600	100	v4_100	v5_100
300	k3_300	300	300	300	v4_300	v5_300
200	k2_200	200	200	200	v4_200	v5_200
-- !result
update tab1 set v1 = (select sum(tab2.v1) from tab2), v2 = (select sum(tab2.v2) from tab2);
-- result:
-- !result
select * from tab1;
-- result:
100	k2_100	600	600	100	v4_100	v5_100
300	k3_300	600	600	300	v4_300	v5_300
200	k2_200	600	600	200	v4_200	v5_200
-- !result
CREATE table tab3 (
      k1 INTEGER,
      k2 VARCHAR(50),
      v1 INTEGER,
      v2 INTEGER,
      v3 INTEGER,
      v4 varchar(50),
      v5 varchar(50)
)
ENGINE=OLAP
PRIMARY KEY(`k1`,`k2`)
DISTRIBUTED BY HASH(`k1`) BUCKETS 10
ORDER BY (`v1`, `v2`)
PROPERTIES (
    "replication_num" = "1"
);
-- result:
-- !result
insert into tab3 values (100, "k2_100", 100, 100, 100, "v4_100", "v5_100");
-- result:
-- !result
insert into tab3 values (200, "k2_200", 200, 200, 200, "v4_200", "v5_200");
-- result:
-- !result
insert into tab3 values (300, "k3_300", 300, 300, 300, "v4_300", "v5_300");
-- result:
-- !result
select * from tab3;
-- result:
100	k2_100	100	100	100	v4_100	v5_100
300	k3_300	300	300	300	v4_300	v5_300
200	k2_200	200	200	200	v4_200	v5_200
-- !result
[UC]update tab3 set v1 = 1111, v2 = (select sum(tab2.v2) from tab2);
-- result:
E: (5609, '172.26.80.32: column mode partial update on table with sort key cannot update sort key column')
-- !result
select * from tab3;
-- result:
100	k2_100	100	100	100	v4_100	v5_100
300	k3_300	300	300	300	v4_300	v5_300
200	k2_200	200	200	200	v4_200	v5_200
-- !result
-- name: test_partial_update_with_expr
create database test_partial_update_with_expr;
-- result:
-- !result
use test_partial_update_with_expr;
-- result:
-- !result
CREATE TABLE `tab1` (
  `k1` bigint(20) NOT NULL COMMENT "",
  `v1` bigint(20) NULL COMMENT "",
  `v2` bigint(20) NULL COMMENT "",
  `v3` datetime NULL DEFAULT CURRENT_TIMESTAMP COMMENT ""
) ENGINE=OLAP
PRIMARY KEY(`k1`)
DISTRIBUTED BY HASH(`k1`) BUCKETS 1
PROPERTIES (
"compression" = "LZ4",
"fast_schema_evolution" = "true",
"replicated_storage" = "true",
"replication_num" = "1"
);
-- result:
-- !result
insert into tab1 values (101, 1, 1, '2024-08-27 00:00:00');
-- result:
-- !result
insert into tab1 values (201, 2, 2, '2024-08-27 00:00:00');
-- result:
-- !result
select count(1) from tab1 where 'v3' is not null;
-- result:
2
-- !result
insert into tab1 (k1, v1, v2) values (301, 3, 3);
-- result:
-- !result
select count(1) from tab1 where 'v3' is not null;
-- result:
3
-- !result
shell: curl --location-trusted -u root: -T ${root_path}/lib/../common/data/stream_load/sr_partial_update_5.csv -XPUT -H partial_update:true -H label:stream_load_partial_update_123433 -H column_separator:, -H columns:k1,v1,v2 ${url}/api/test_partial_update_with_expr/tab1/_stream_load
-- result:
0
{
    "Status": "Success",
    "Message": "OK"
}
-- !result
sync;
-- result:
-- !result
select count(1) from tab1 where 'v3' is not null;
-- result:
5
-- !result
shell: curl --location-trusted -u root: -T ${root_path}/lib/../common/data/stream_load/sr_auto_increment_partial_update_only.csv -XPUT -H partial_update:true  -H partial_update_mode:column -H label:stream_load_partial_update_123434 -H column_separator:, -H columns:k1,v1,v2 ${url}/api/test_partial_update_with_expr/tab1/_stream_load
-- result:
0
{
    "Status": "Success",
    "Message": "OK"
}
-- !result
sync;
-- result:
-- !result
select count(1) from tab1 where 'v3' is not null;
-- result:
7
-- !result
drop database test_partial_update_with_expr;
-- result:
-- !result
-- name: test_column_partial_update_with_condition_update @native
create database test_column_partial_update_with_condition_update;
-- result:
-- !result
use test_column_partial_update_with_condition_update;
-- result:
-- !result
CREATE TABLE site_access (
  site_id int(11) not NULL DEFAULT "10" COMMENT "",
  event_day date NULL COMMENT "",
  city_code varchar(100) NULL COMMENT "",
  user_name varchar(32) NULL DEFAULT "" COMMENT "",
  pv bigint(20) NULL DEFAULT "0" COMMENT ""
) ENGINE=OLAP 
PRIMARY KEY(site_id)
DISTRIBUTED BY HASH(site_id)
PROPERTIES (
"compression" = "LZ4",
"fast_schema_evolution" = "true",
"replication_num" = "1"
);
-- result:
-- !result
insert into site_access values
(22,'2024-07-22','bsgs','zs',22),
(23,'2024-07-23','bsgs','zs',23),
(24,'2024-07-24','bsgs','zs',24),
(25,'2024-07-25','bsgs','zs',25),
(26,'2024-07-26','bsgs','zs',26),
(27,'2024-07-27','bsgs','zs',27),
(28,'2024-07-28','bsgs','zs',28),
(29,'2024-07-29','bsgs','zs',29);
-- result:
-- !result
select * from site_access;
-- result:
27	2024-07-27	bsgs	zs	27
26	2024-07-26	bsgs	zs	26
23	2024-07-23	bsgs	zs	23
28	2024-07-28	bsgs	zs	28
24	2024-07-24	bsgs	zs	24
25	2024-07-25	bsgs	zs	25
29	2024-07-29	bsgs	zs	29
22	2024-07-22	bsgs	zs	22
-- !result
shell: curl --location-trusted -u root: -T ${root_path}/lib/../common/data/stream_load/sr_partial_update_8.csv -XPUT -H partial_update:true  -H label:label10324  -H columns:site_id,event_day,user_name -H column_separator:,  -H partial_update:true -H partial_update_mode:column -H merge_condition:event_day ${url}/api/test_column_partial_update_with_condition_update/site_access/_stream_load
-- result:
0
{
    "Status": "Success",
    "Message": "OK"
}
-- !result
sync;
-- result:
-- !result
select * from site_access;
-- result:
27	None	bsgs	'll'	27
26	None	bsgs	'll'	26
25	None	bsgs	'll'	25
23	None	bsgs	'll'	23
28	None	bsgs	'll'	28
24	None	bsgs	'll'	24
29	2024-07-29	bsgs	zs	29
22	None	bsgs	'll'	22
-- !result
drop database test_column_partial_update_with_condition_update;
-- result:
-- !result




-- name: test_lake_column_partial_update_with_condition_update @sequential @cloud
create database test_lake_column_partial_update_with_condition_update;
-- result:
-- !result
use test_lake_column_partial_update_with_condition_update;
-- result:
-- !result
CREATE TABLE tab1 (
  k INT NOT NULL,
  ver INT NOT NULL,
  v1 INT NULL,
  v2 INT NULL
) ENGINE=OLAP
PRIMARY KEY(k)
DISTRIBUTED BY HASH(k) BUCKETS 1
PROPERTIES ("replication_num" = "1");
-- result:
-- !result
insert into tab1 values (1, 10, 100, 1000), (2, 20, 200, 2000);
-- result:
-- !result
select * from tab1 order by k;
-- result:
1	10	100	1000
2	20	200	2000
-- !result
shell: curl --location-trusted -u root: -d "1,5,999|2,30,888" -XPUT -H label:lake_pcu_cond_ok -H column_separator:, -H row_delimiter:| -H partial_update:true -H partial_update_mode:column -H merge_condition:ver -H columns:k,ver,v1 ${url}/api/test_lake_column_partial_update_with_condition_update/tab1/_stream_load
-- result:
0
{
    "Status": "Success",
    "Message": "OK"
}
-- !result
sync;
-- result:
-- !result
select * from tab1 order by k;
-- result:
1	10	100	1000
2	30	888	2000
-- !result
shell: curl --location-trusted -u root: -d "1,5,999|2,30,888" -XPUT -H label:lake_pcu_cond_bad -H column_separator:, -H row_delimiter:| -H partial_update:true -H partial_update_mode:column -H merge_condition:v2 -H columns:k,ver,v1 ${url}/api/test_lake_column_partial_update_with_condition_update/tab1/_stream_load
-- result:
0
{
    "Status": "Fail",
    "Message": "Merge condition column v2 does not exist. If you are doing partial update with condition update, please check condition column is in the given update columns. Otherwise please check condition column is in table tab1"
}
-- !result
sync;
-- result:
-- !result
select * from tab1 order by k;
-- result:
1	10	100	1000
2	30	888	2000
-- !result
drop database test_lake_column_partial_update_with_condition_update;
-- result:
-- !result





-- name: test_lake_column_pcu_condition_after_drop_column @sequential @cloud
create database test_lake_column_pcu_condition_after_drop_column;
-- result:
-- !result
use test_lake_column_pcu_condition_after_drop_column;
-- result:
-- !result
CREATE TABLE tab1 (
  k INT NOT NULL,
  v1 INT NULL,
  v2 INT NULL,
  v3 INT NULL,
  ver INT NOT NULL,
  v4 INT NULL
) ENGINE=OLAP
PRIMARY KEY(k)
DISTRIBUTED BY HASH(k) BUCKETS 1
PROPERTIES ("replication_num" = "1");
-- result:
-- !result
insert into tab1 values (1, 1, 1, 1, 10, 1), (2, 2, 2, 2, 20, 2);
-- result:
-- !result
select * from tab1 order by k;
-- result:
1	1	1	1	10	1
2	2	2	2	20	2
-- !result
alter table tab1 drop column v2;
-- result:
-- !result
function: wait_alter_table_finish()
-- result:
None
-- !result
select * from tab1 order by k;
-- result:
1	1	1	10	1
2	2	2	20	2
-- !result
shell: curl --location-trusted -u root: -d "1,5,777|2,30,888" -XPUT -H label:lake_pcu_cond_drop -H column_separator:, -H row_delimiter:| -H partial_update:true -H partial_update_mode:column -H merge_condition:ver -H columns:k,ver,v3 ${url}/api/test_lake_column_pcu_condition_after_drop_column/tab1/_stream_load
-- result:
0
{
    "Status": "Success",
    "Message": "OK"
}
-- !result
sync;
-- result:
-- !result
select * from tab1 order by k;
-- result:
1	1	1	10	1
2	2	888	30	2
-- !result
drop database test_lake_column_pcu_condition_after_drop_column;
-- result:
-- !result







-- name: test_lake_column_pcu_condition_after_add_column @sequential @cloud
create database test_lake_column_pcu_condition_after_add_column;
-- result:
-- !result
use test_lake_column_pcu_condition_after_add_column;
-- result:
-- !result
CREATE TABLE tab1 (
  k INT NOT NULL,
  ver INT NOT NULL,
  v1 INT NULL
) ENGINE=OLAP
PRIMARY KEY(k)
DISTRIBUTED BY HASH(k) BUCKETS 1
PROPERTIES ("replication_num" = "1");
-- result:
-- !result
insert into tab1 values (1, 10, 100), (2, 20, 200);
-- result:
-- !result
select * from tab1 order by k;
-- result:
1	10	100
2	20	200
-- !result
alter table tab1 add column v2 INT NULL DEFAULT "999";
-- result:
-- !result
function: wait_alter_table_finish()
-- result:
None
-- !result
select * from tab1 order by k;
-- result:
1	10	100	999
2	20	200	999
-- !result
shell: curl --location-trusted -u root: -d "1,5,777|2,30,888|3,50,555" -XPUT -H label:lake_pcu_cond_add -H column_separator:, -H row_delimiter:| -H partial_update:true -H partial_update_mode:column -H merge_condition:ver -H columns:k,ver,v1 ${url}/api/test_lake_column_pcu_condition_after_add_column/tab1/_stream_load
-- result:
0
{
    "Status": "Success",
    "Message": "OK"
}
-- !result
sync;
-- result:
-- !result
select * from tab1 order by k;
-- result:
1	10	100	999
2	30	888	999
3	50	555	999
-- !result
drop database test_lake_column_pcu_condition_after_add_column;
-- result:
-- !result


-- name: test_lake_column_pcu_condition_with_order_by @sequential @cloud
create database test_lake_column_pcu_condition_with_order_by;
-- result:
-- !result
use test_lake_column_pcu_condition_with_order_by;
-- result:
-- !result
CREATE TABLE tab1 (
  k INT NOT NULL,
  ver INT NOT NULL,
  v1 INT NULL,
  v2 INT NULL
) ENGINE=OLAP
PRIMARY KEY(k)
DISTRIBUTED BY HASH(k) BUCKETS 1
ORDER BY (ver)
PROPERTIES ("replication_num" = "1");
-- result:
-- !result
insert into tab1 values (1, 10, 100, 1000), (2, 20, 200, 2000);
-- result:
-- !result
select * from tab1 order by k;
-- result:
1	10	100	1000
2	20	200	2000
-- !result
shell: curl --location-trusted -u root: -d "1,5,999|2,30,888" -XPUT -H label:lake_pcu_cond_orderby -H column_separator:, -H row_delimiter:| -H partial_update:true -H partial_update_mode:column -H merge_condition:ver -H columns:k,ver,v1 ${url}/api/test_lake_column_pcu_condition_with_order_by/tab1/_stream_load 2>/dev/null | grep -oE '"Status": *"Fail"|partial update on table with sort key must provide all sort key columns' | sort -u
-- result:
0
partial update on table with sort key must provide all sort key columns
"Status": "Fail"
-- !result
sync;
-- result:
-- !result
select * from tab1 order by k;
-- result:
1	10	100	1000
2	20	200	2000
-- !result
drop database test_lake_column_pcu_condition_with_order_by;
-- result:
-- !result