-- name: test_partial_update_sort_key
show backends;
CREATE TABLE `tab1` (
  `k0` int(11) NOT NULL COMMENT "",
  `k1` int(11) NULL COMMENT "",
  `k2` int(11) NULL COMMENT "",
  `k3` int(11) NULL COMMENT "",
  `k4` int(11) NULL COMMENT "",
  `k5` int(11) NULL COMMENT "",
  `v1` int(11) NULL COMMENT "",
  `v2` int(11) NULL COMMENT ""
) ENGINE=OLAP
PRIMARY KEY(`k0`)
DISTRIBUTED BY HASH(`k0`) BUCKETS 1
ORDER BY(`k3`, `k2`)
PROPERTIES (
"replication_num" = "1"
);
-- result:
-- !result
INSERT INTO `tab1` (`k0`, `k1`, `k2`, `k3`, `k4`, `k5`, `v1`, `v2`) VALUES (1, 1, 1, 1, 1, 1, 1, 1), (2, 2, 2, 2, 2, 2, 2, 2), (3, 3, 3, 3, 3, 3, 3, 3), (4, 4, 4, 4, 4, 4, 4, 4);
-- result:
-- !result
select * from tab1 order by k0;
-- result:
1	1	1	1	1	1	1	1
2	2	2	2	2	2	2	2
3	3	3	3	3	3	3	3
4	4	4	4	4	4	4	4
-- !result
set partial_update_mode = "column";
-- result:
-- !result
update tab1 set k4 = 1, k2 = 1, k3 = 1;
-- result:
[REGEX].*column mode partial update on table with sort key cannot update sort key column.*
-- !result
update tab1 set k4 = 1, k2 = 1;
-- result:
[REGEX].*column mode partial update on table with sort key cannot update sort key column.*
-- !result
update tab1 set k4 = 1;
-- result:
-- !result
select * from tab1 order by k0;
-- result:
1	1	1	1	1	1	1	1
2	2	2	2	1	2	2	2
3	3	3	3	1	3	3	3
4	4	4	4	1	4	4	4
-- !result