-- name: test_runtime_filter_min_max
CREATE TABLE t_minmax (
    k1 INT NOT NULL,
    c_int INT NULL,
    c_bigint BIGINT NULL,
    c_date DATE NULL,
    c_string STRING NULL
) ENGINE=OLAP
DUPLICATE KEY(k1)
DISTRIBUTED BY HASH(k1) BUCKETS 8
PROPERTIES (
    "replication_num" = "1"
);
-- result:
-- !result
INSERT INTO t_minmax
SELECT
    idx,
    idx % 100 + 1,
    idx * 2,
    CAST(date_add('2024-01-01', INTERVAL (idx % 30) DAY) AS DATE),
    concat('str-', idx)
FROM TABLE(generate_series(0, 9999)) AS t(idx);
-- result:
-- !result
CREATE TABLE t_probe (
    k1 INT NOT NULL,
    probe_value INT NULL
) ENGINE=OLAP
PRIMARY KEY(k1)
DISTRIBUTED BY HASH(k1) BUCKETS 8
PROPERTIES (
    "replication_num" = "1"
);
-- result:
-- !result
INSERT INTO t_probe
SELECT idx, idx % 50 FROM TABLE(generate_series(0, 999)) AS t(idx);
-- result:
-- !result
DELETE FROM t_minmax WHERE k1 < 100;
-- result:
-- !result
DELETE FROM t_probe WHERE k1 < 100;
-- result:
-- !result
set enable_min_max_runtime_filter=true;
-- result:
-- !result
set enable_rewrite_simple_agg_to_meta_scan=false;
-- result:
-- !result
function: assert_explain_verbose_contains('SELECT MIN(c_int) AS min_val FROM t_minmax', '- filter_id = 0', 'build_expr')
-- result:
None
-- !result
function: assert_explain_verbose_contains('SELECT MAX(c_int) AS max_val FROM t_minmax', '- filter_id = 0', 'build_expr')
-- result:
None
-- !result
SELECT MIN(c_int) AS min_val FROM t_minmax;
-- result:
1
-- !result
SELECT MAX(c_int) AS max_val FROM t_minmax;
-- result:
100
-- !result
SELECT MIN(c_int) AS min_val, MAX(c_int) AS max_val FROM t_minmax;
-- result:
1	100
-- !result
SELECT MIN(c_int) AS min_int, MAX(c_bigint) AS max_bigint FROM t_minmax;
-- result:
1	19998
-- !result
SELECT MIN(c_int) AS min_val FROM t_minmax WHERE c_int BETWEEN 20 AND 50;
-- result:
20
-- !result
SELECT /*+SET_VAR(enable_min_max_runtime_filter=true)*/ COUNT(*)
FROM t_probe p
JOIN [broadcast] t_minmax m ON p.probe_value = m.c_int
WHERE p.k1 < 100;
-- result:
0
-- !result
SELECT /*+SET_VAR(enable_min_max_runtime_filter=true)*/ COUNT(*)
FROM t_probe p
JOIN [broadcast] t_minmax m ON p.probe_value = m.c_int
WHERE p.k1 >= 900;
-- result:
9702
-- !result
SELECT
    MIN(c_int) AS min_int,
    MAX(c_int) AS max_int,
    MIN(c_bigint) AS min_bigint,
    MAX(c_bigint) AS max_bigint
FROM t_minmax;
-- result:
1	100	200	19998
-- !result
SELECT MIN(c_date) AS earliest, MAX(c_date) AS latest FROM t_minmax;
-- result:
2024-01-01	2024-01-30
-- !result
SELECT MIN(c_string) AS first_str, MAX(c_string) AS last_str FROM t_minmax;
-- result:
str-100	str-9999
-- !result
SELECT COUNT(*), SUM(c_int) FROM t_minmax;
-- result:
9900	499950
-- !result
SELECT c_int % 10 AS grp, MIN(c_bigint) AS min_bigint
FROM t_minmax
GROUP BY c_int % 10
ORDER BY grp
LIMIT 5;
-- result:
0	218
1	200
2	202
3	204
4	206
-- !result
SELECT COUNT(*)
FROM t_minmax m
JOIN (
    SELECT MIN(m2.c_int) AS min_int, MAX(m2.c_int) AS max_int
    FROM t_minmax m2
    JOIN t_probe p2 ON m2.c_int = p2.probe_value
) s ON m.c_int BETWEEN s.min_int AND s.max_int;
-- result:
4851
-- !result
INSERT INTO t_minmax
SELECT
    idx,
    idx % 100 + 1,
    idx * 2,
    CAST(date_add('2024-01-01', INTERVAL (idx % 30) DAY) AS DATE),
    concat('str-', idx)
FROM TABLE(generate_series(9999, 10999)) AS t(idx);
-- result:
-- !result
INSERT INTO t_probe
SELECT idx, idx % 50 FROM TABLE(generate_series(10000, 10999)) AS t(idx);
-- result:
-- !result
DELETE FROM t_minmax WHERE k1 < 100;
-- result:
-- !result
DELETE FROM t_probe WHERE k1 < 100;
-- result:
-- !result
function: assert_explain_verbose_contains('SELECT MIN(c_int) AS min_val FROM t_minmax', '- filter_id = 0', 'build_expr')
-- result:
None
-- !result
function: assert_explain_verbose_contains('SELECT MAX(c_int) AS max_val FROM t_minmax', '- filter_id = 0', 'build_expr')
-- result:
None
-- !result
SELECT MIN(c_int) AS min_val FROM t_minmax;
-- result:
1
-- !result
SELECT MAX(c_int) AS max_val FROM t_minmax;
-- result:
100
-- !result
SELECT MIN(c_int) AS min_val, MAX(c_int) AS max_val FROM t_minmax;
-- result:
1	100
-- !result
SELECT MIN(c_int) AS min_int, MAX(c_bigint) AS max_bigint FROM t_minmax;
-- result:
1	21998
-- !result
SELECT MIN(c_int) AS min_val FROM t_minmax WHERE c_int BETWEEN 20 AND 50;
-- result:
20
-- !result
SELECT /*+SET_VAR(enable_min_max_runtime_filter=true)*/ COUNT(*)
FROM t_probe p
JOIN [broadcast] t_minmax m ON p.probe_value = m.c_int
WHERE p.k1 < 100;
-- result:
0
-- !result
SELECT /*+SET_VAR(enable_min_max_runtime_filter=true)*/ COUNT(*)
FROM t_probe p
JOIN [broadcast] t_minmax m ON p.probe_value = m.c_int
WHERE p.k1 >= 900;
-- result:
117502
-- !result
SELECT
    MIN(c_int) AS min_int,
    MAX(c_int) AS max_int,
    MIN(c_bigint) AS min_bigint,
    MAX(c_bigint) AS max_bigint
FROM t_minmax;
-- result:
1	100	200	21998
-- !result
SELECT MIN(c_date) AS earliest, MAX(c_date) AS latest FROM t_minmax;
-- result:
2024-01-01	2024-01-30
-- !result
SELECT MIN(c_string) AS first_str, MAX(c_string) AS last_str FROM t_minmax;
-- result:
str-100	str-9999
-- !result
SELECT COUNT(*), SUM(c_int) FROM t_minmax;
-- result:
10901	550550
-- !result
SELECT c_int % 10 AS grp, MIN(c_bigint) AS min_bigint
FROM t_minmax
GROUP BY c_int % 10
ORDER BY grp
LIMIT 5;
-- result:
0	218
1	200
2	202
3	204
4	206
-- !result
SELECT COUNT(*)
FROM t_minmax m
JOIN (
    SELECT MIN(m2.c_int) AS min_int, MAX(m2.c_int) AS max_int
    FROM t_minmax m2
    JOIN t_probe p2 ON m2.c_int = p2.probe_value
) s ON m.c_int BETWEEN s.min_int AND s.max_int;
-- result:
5341
-- !result
DROP TABLE IF EXISTS t_probe;
-- result:
-- !result
DROP TABLE IF EXISTS t_minmax;
-- result:
-- !result