-- name: test_logical_sink_mv
CREATE TABLE b_id (k INT, v INT) DUPLICATE KEY(k) DISTRIBUTED BY HASH(k) BUCKETS 2 PROPERTIES('replication_num'='1');
-- result:
-- !result
CREATE TABLE t_id (k INT, v INT) DUPLICATE KEY(k) DISTRIBUTED BY HASH(k) BUCKETS 2 PROPERTIES('replication_num'='1');
-- result:
-- !result
CREATE MATERIALIZED VIEW mv_id TO t_id AS SELECT k, v FROM b_id;
-- result:
-- !result
INSERT INTO b_id VALUES (1,10),(2,20),(3,30);
-- result:
-- !result
SELECT * FROM b_id ORDER BY k;
-- result:
1	10
2	20
3	30
-- !result
SELECT * FROM t_id ORDER BY k;
-- result:
1	10
2	20
3	30
-- !result
CREATE TABLE b_tw (k INT, v INT) DUPLICATE KEY(k) DISTRIBUTED BY HASH(k) BUCKETS 2 PROPERTIES('replication_num'='1');
-- result:
-- !result
CREATE TABLE t_tw (k INT, v2 INT) DUPLICATE KEY(k) DISTRIBUTED BY HASH(k) BUCKETS 2 PROPERTIES('replication_num'='1');
-- result:
-- !result
CREATE MATERIALIZED VIEW mv_tw TO t_tw AS SELECT k, v * 2 FROM b_tw WHERE v > 15;
-- result:
-- !result
INSERT INTO b_tw VALUES (1,10),(2,20),(3,100);
-- result:
-- !result
SELECT * FROM t_tw ORDER BY k;
-- result:
2	40
3	200
-- !result
CREATE TABLE b_j (k INT, v INT) DUPLICATE KEY(k) DISTRIBUTED BY HASH(k) BUCKETS 2 PROPERTIES('replication_num'='1');
-- result:
-- !result
CREATE TABLE dim (id INT, name VARCHAR(32)) DUPLICATE KEY(id) DISTRIBUTED BY HASH(id) BUCKETS 2 PROPERTIES('replication_num'='1');
-- result:
-- !result
CREATE TABLE t_j (k INT, name VARCHAR(32)) DUPLICATE KEY(k) DISTRIBUTED BY HASH(k) BUCKETS 2 PROPERTIES('replication_num'='1');
-- result:
-- !result
INSERT INTO dim VALUES (1,'one'),(2,'two');
-- result:
-- !result
CREATE MATERIALIZED VIEW mv_j TO t_j AS SELECT b.k, d.name FROM b_j b JOIN dim d ON b.k = d.id;
-- result:
-- !result
INSERT INTO b_j VALUES (1,10),(2,20),(9,90);
-- result:
-- !result
SELECT * FROM b_j ORDER BY k;
-- result:
1	10
2	20
9	90
-- !result
SELECT * FROM t_j ORDER BY k;
-- result:
1	one
2	two
-- !result
CREATE TABLE b_agg (k INT, v INT) DUPLICATE KEY(k) DISTRIBUTED BY HASH(k) BUCKETS 2 PROPERTIES('replication_num'='1');
-- result:
-- !result
CREATE TABLE t_sum (k INT, s BIGINT SUM) AGGREGATE KEY(k) DISTRIBUTED BY HASH(k) BUCKETS 2 PROPERTIES('replication_num'='1');
-- result:
-- !result
CREATE TABLE t_cnt (k INT, c BIGINT SUM) AGGREGATE KEY(k) DISTRIBUTED BY HASH(k) BUCKETS 2 PROPERTIES('replication_num'='1');
-- result:
-- !result
CREATE MATERIALIZED VIEW mv_sum TO t_sum AS SELECT k, sum(v) FROM b_agg GROUP BY k;
-- result:
-- !result
CREATE MATERIALIZED VIEW mv_cnt TO t_cnt AS SELECT k, count(v) FROM b_agg GROUP BY k;
-- result:
-- !result
INSERT INTO b_agg VALUES (1,10),(1,20),(2,5);
-- result:
-- !result
INSERT INTO b_agg VALUES (1,100);
-- result:
-- !result
SELECT * FROM t_sum ORDER BY k;
-- result:
1	130
2	5
-- !result
SELECT * FROM t_cnt ORDER BY k;
-- result:
1	3
2	1
-- !result
CREATE TABLE b_bm (k INT, v INT) DUPLICATE KEY(k) DISTRIBUTED BY HASH(k) BUCKETS 2 PROPERTIES('replication_num'='1');
-- result:
-- !result
CREATE TABLE t_bm (k INT, bm BITMAP BITMAP_UNION) AGGREGATE KEY(k) DISTRIBUTED BY HASH(k) BUCKETS 2 PROPERTIES('replication_num'='1');
-- result:
-- !result
CREATE MATERIALIZED VIEW mv_bm TO t_bm AS SELECT k, bitmap_union(to_bitmap(v)) FROM b_bm GROUP BY k;
-- result:
-- !result
INSERT INTO b_bm VALUES (1,10),(1,20),(1,10),(2,5);
-- result:
-- !result
INSERT INTO b_bm VALUES (1,30);
-- result:
-- !result
SELECT k, bitmap_union_count(bm) FROM t_bm GROUP BY k ORDER BY k;
-- result:
1	3
2	1
-- !result
CREATE TABLE b_av (k INT, v INT) DUPLICATE KEY(k) DISTRIBUTED BY HASH(k) BUCKETS 2 PROPERTIES('replication_num'='1');
-- result:
-- !result
CREATE TABLE t_av (k INT, av avg(int)) AGGREGATE KEY(k) DISTRIBUTED BY HASH(k) BUCKETS 2 PROPERTIES('replication_num'='1');
-- result:
-- !result
CREATE MATERIALIZED VIEW mv_av TO t_av AS SELECT k, avg_union(avg_state(v)) FROM b_av GROUP BY k;
-- result:
-- !result
INSERT INTO b_av VALUES (1,10),(1,20),(2,100);
-- result:
-- !result
INSERT INTO b_av VALUES (1,30);
-- result:
-- !result
SELECT k, avg_merge(av) FROM t_av GROUP BY k ORDER BY k;
-- result:
1	20.0
2	100.0
-- !result
CREATE TABLE b_bad (k INT, v INT) DUPLICATE KEY(k) DISTRIBUTED BY HASH(k) BUCKETS 2 PROPERTIES('replication_num'='1');
-- result:
-- !result
CREATE TABLE t_bad (k INT, s BIGINT SUM) AGGREGATE KEY(k) DISTRIBUTED BY HASH(k) BUCKETS 2 PROPERTIES('replication_num'='1');
-- result:
-- !result
CREATE MATERIALIZED VIEW mv_bad TO t_bad AS SELECT k, max(v) FROM b_bad GROUP BY k;
-- result:
E: (1064, "Getting analyzing error. Detail message: logical-sink MV: SELECT item 2 'max' does not match target column 's' aggregation SUM.")
-- !result
CREATE TABLE b_bf (k INT, v INT) DUPLICATE KEY(k) DISTRIBUTED BY HASH(k) BUCKETS 2 PROPERTIES('replication_num'='1');
-- result:
-- !result
CREATE TABLE t_bf (k INT, v INT) DUPLICATE KEY(k) DISTRIBUTED BY HASH(k) BUCKETS 2 PROPERTIES('replication_num'='1');
-- result:
-- !result
INSERT INTO b_bf VALUES (1,1);
-- result:
-- !result
CREATE MATERIALIZED VIEW mv_bf TO t_bf AS SELECT k, v FROM b_bf;
-- result:
-- !result
INSERT INTO b_bf VALUES (2,2);
-- result:
-- !result
SELECT * FROM b_bf ORDER BY k;
-- result:
1	1
2	2
-- !result
SELECT * FROM t_bf ORDER BY k;
-- result:
2	2
-- !result
DELETE FROM b_bf WHERE k = 2;
-- result:
-- !result
SELECT * FROM b_bf ORDER BY k;
-- result:
1	1
-- !result
SELECT * FROM t_bf ORDER BY k;
-- result:
2	2
-- !result
CREATE TABLE b_snap (k INT, v INT) DUPLICATE KEY(k) DISTRIBUTED BY HASH(k) BUCKETS 2 PROPERTIES('replication_num'='1');
-- result:
-- !result
CREATE TABLE d_snap (id INT, name VARCHAR(16)) DUPLICATE KEY(id) DISTRIBUTED BY HASH(id) BUCKETS 2 PROPERTIES('replication_num'='1');
-- result:
-- !result
CREATE TABLE t_snap (k INT, name VARCHAR(16)) DUPLICATE KEY(k) DISTRIBUTED BY HASH(k) BUCKETS 2 PROPERTIES('replication_num'='1');
-- result:
-- !result
INSERT INTO d_snap VALUES (1,'A');
-- result:
-- !result
CREATE MATERIALIZED VIEW mv_snap TO t_snap AS SELECT b.k, d.name FROM b_snap b JOIN d_snap d ON b.k = d.id;
-- result:
-- !result
INSERT INTO b_snap VALUES (1,10);
-- result:
-- !result
DELETE FROM d_snap WHERE id = 1;
-- result:
-- !result
INSERT INTO d_snap VALUES (1,'B');
-- result:
-- !result
INSERT INTO b_snap VALUES (1,10);
-- result:
-- !result
SELECT * FROM t_snap ORDER BY k, name;
-- result:
1	A
1	B
-- !result
INSERT OVERWRITE b_bf VALUES (7,7);
-- result:
E: (1064, 'Getting analyzing error. Detail message: INSERT OVERWRITE is not supported on a base table with CK-compatible logical-sink materialized views (insert-triggered only); use INSERT INTO.')
-- !result
CREATE TABLE b_ad (k INT, v INT) DUPLICATE KEY(k) DISTRIBUTED BY HASH(k) BUCKETS 2 PROPERTIES("replication_num"="1");
-- result:
-- !result
CREATE TABLE t_ad_dup (k INT, s BIGINT) DUPLICATE KEY(k) DISTRIBUTED BY HASH(k) BUCKETS 2 PROPERTIES("replication_num"="1");
-- result:
-- !result
CREATE MATERIALIZED VIEW mv_ad TO t_ad_dup AS SELECT k, sum(v) FROM b_ad GROUP BY k;
-- result:
E: (1064, "Getting analyzing error. Detail message: logical-sink MV: SELECT item 2 is an aggregate but target column 's' has no storage aggregation; per-INSERT partial aggregates would accumulate as separate rows. Write it to an AGGREGATE table whose value column has a matching aggregation (SUM/MIN/MAX/BITMAP_UNION/HLL_UNION/PERCENTILE_UNION) or an agg_state column..")
-- !result