-- name: test_partitioned_mv_with_dropped_partitions
create external catalog mv_iceberg_${uuid0}
properties
(
    "type" = "iceberg",
    "iceberg.catalog.type" = "hive",
    "hive.metastore.uris" = "${iceberg_catalog_hive_metastore_uris}"
);
-- result:
-- !result
set new_planner_optimize_timeout=10000;
-- result:
-- !result
set enable_materialized_view_transparent_union_rewrite = true;
-- result:
-- !result
set catalog mv_iceberg_${uuid0};
-- result:
-- !result
create database mv_iceberg_db_${uuid0};
-- result:
-- !result
use mv_iceberg_db_${uuid0};
-- result:
-- !result
CREATE TABLE mv_iceberg_${uuid0}.mv_iceberg_db_${uuid0}.t1 (
    num int,
    dt string
)
PARTITION BY (dt);
-- result:
-- !result
INSERT INTO mv_iceberg_${uuid0}.mv_iceberg_db_${uuid0}.t1 VALUES
    (1,"2020-06-15"),(2,"2020-06-15"),
    (2,"2020-06-18"),(3,"2020-06-18"),
    (3,"2020-06-21"),(4,"2020-06-21");
-- result:
-- !result
set catalog default_catalog;
-- result:
-- !result
create database db_${uuid0};
-- result:
-- !result
use db_${uuid0};
-- result:
-- !result
CREATE MATERIALIZED VIEW partitioned_mv_loose 
PARTITION BY (dt)
REFRESH DEFERRED MANUAL 
PROPERTIES (
    "replication_num" = "1",
    "query_rewrite_consistency" = "LOOSE"
)
AS 
SELECT dt, sum(num) as total_num 
FROM mv_iceberg_${uuid0}.mv_iceberg_db_${uuid0}.t1 
GROUP BY dt;
-- result:
-- !result
[UC]REFRESH MATERIALIZED VIEW partitioned_mv_loose WITH SYNC MODE;
-- result:
019cf9b7-eabd-79a7-89f8-71c91ba89137
-- !result
SELECT * FROM partitioned_mv_loose ORDER BY dt;
-- result:
2020-06-15	3
2020-06-18	5
2020-06-21	7
-- !result
function: print_hit_materialized_view("SELECT dt, sum(num) FROM mv_iceberg_${uuid0}.mv_iceberg_db_${uuid0}.t1 WHERE dt='2020-06-15' GROUP BY dt;", "partitioned_mv_loose")
-- result:
True
-- !result
set catalog mv_iceberg_${uuid0};
-- result:
-- !result
DELETE FROM mv_iceberg_${uuid0}.mv_iceberg_db_${uuid0}.t1 WHERE dt = '2020-06-15';
-- result:
-- !result
set catalog default_catalog;
-- result:
-- !result
use db_${uuid0};
-- result:
-- !result
function: print_hit_materialized_view("SELECT dt, sum(num) FROM mv_iceberg_${uuid0}.mv_iceberg_db_${uuid0}.t1 WHERE dt='2020-06-15' GROUP BY dt;", "partitioned_mv_loose")
-- result:
False
-- !result
function: print_hit_materialized_view("SELECT dt, sum(num) FROM mv_iceberg_${uuid0}.mv_iceberg_db_${uuid0}.t1 WHERE dt='2020-06-18' GROUP BY dt;", "partitioned_mv_loose")
-- result:
True
-- !result
[UC]REFRESH MATERIALIZED VIEW partitioned_mv_loose WITH SYNC MODE;
-- result:
019cf9b8-0195-749c-9f05-3bc5f282ea50
-- !result
SELECT * FROM partitioned_mv_loose ORDER BY dt;
-- result:
2020-06-18	5
2020-06-21	7
-- !result
CREATE MATERIALIZED VIEW partitioned_mv_force 
PARTITION BY (dt)
REFRESH DEFERRED MANUAL 
PROPERTIES (
    "replication_num" = "1",
    "query_rewrite_consistency" = "FORCE_MV"
)
AS 
SELECT dt, sum(num) as total_num 
FROM mv_iceberg_${uuid0}.mv_iceberg_db_${uuid0}.t1 
GROUP BY dt;
-- result:
-- !result
[UC]REFRESH MATERIALIZED VIEW partitioned_mv_force WITH SYNC MODE;
-- result:
019cf9b8-057c-7a32-80e0-650c97fb46af
-- !result
SELECT * FROM partitioned_mv_force ORDER BY dt;
-- result:
2020-06-18	5
2020-06-21	7
-- !result
DROP MATERIALIZED VIEW partitioned_mv_loose;
-- result:
-- !result
DROP MATERIALIZED VIEW partitioned_mv_force;
-- result:
-- !result
DROP DATABASE db_${uuid0};
-- result:
-- !result
set catalog mv_iceberg_${uuid0};
-- result:
-- !result
DROP TABLE mv_iceberg_${uuid0}.mv_iceberg_db_${uuid0}.t1;
-- result:
-- !result
DROP DATABASE mv_iceberg_db_${uuid0} FORCE;
-- result:
-- !result
DROP CATALOG mv_iceberg_${uuid0};
-- result:
-- !result