-- name: test_ivm_with_iceberg_partition_shape_error @slow
create external catalog mv_iceberg_${uuid0}
properties
(
    "type" = "iceberg",
    "iceberg.catalog.type" = "hive",
    "hive.metastore.uris" = "${iceberg_catalog_hive_metastore_uris}"
);
-- result:
-- !result
set catalog mv_iceberg_${uuid0};
-- result:
-- !result
create database mv_ice_db_${uuid0};
-- result:
-- !result
use mv_ice_db_${uuid0};
-- result:
-- !result
create table t1 (
  col_str string,
  col_int int,
  dt date
) partition by(dt)
properties ('history.expire.max-snapshot-age-ms' = '1');
-- result:
-- !result
insert into t1 values
  ('a', 1, '2023-12-01'), ('a', 2, '2023-12-01'),
  ('b', 3, '2023-12-02'), ('b', 4, '2023-12-02'),
  ('c', 5, '2023-12-03'), ('c', 6, '2023-12-03');
-- result:
-- !result
set catalog default_catalog;
-- result:
-- !result
create database db_${uuid0};
-- result:
-- !result
use db_${uuid0};
-- result:
-- !result
set enable_materialized_view_rewrite = false;
-- result:
-- !result
CREATE MATERIALIZED VIEW test_mv1 PARTITION BY dt
REFRESH DEFERRED MANUAL
properties ("refresh_mode" = "incremental")
AS SELECT col_str, col_int, dt FROM mv_iceberg_${uuid0}.mv_ice_db_${uuid0}.t1;
-- result:
-- !result
[UC]REFRESH MATERIALIZED VIEW test_mv1 WITH SYNC MODE;
[UC]TASK_NAME=SELECT TASK_NAME FROM information_schema.materialized_views WHERE TABLE_SCHEMA = 'db_${uuid0}' AND TABLE_NAME='test_mv1';
-- result:
mv-0
-- !result
DELETE FROM mv_iceberg_${uuid0}.mv_ice_db_${uuid0}.t1 WHERE col_int = 2;
-- result:
-- !result
[UC]REFRESH MATERIALIZED VIEW test_mv1 WITH SYNC MODE;
SELECT STATE FROM information_schema.task_runs WHERE TASK_NAME = '${TASK_NAME}' ORDER BY FINISH_TIME DESC LIMIT 1;
-- result:
FAILED
-- !result
SELECT ERROR_MESSAGE LIKE '%non-append-only%' FROM information_schema.task_runs WHERE TASK_NAME = '${TASK_NAME}' ORDER BY FINISH_TIME DESC LIMIT 1;
-- result:
1
-- !result
SELECT ERROR_MESSAGE LIKE '%Drop and recreate%' FROM information_schema.task_runs WHERE TASK_NAME = '${TASK_NAME}' ORDER BY FINISH_TIME DESC LIMIT 1;
-- result:
1
-- !result
DROP MATERIALIZED VIEW test_mv1;
-- result:
-- !result
CREATE MATERIALIZED VIEW test_mv2 PARTITION BY dt
REFRESH DEFERRED MANUAL
properties ("refresh_mode" = "incremental")
AS SELECT col_str, col_int, dt FROM mv_iceberg_${uuid0}.mv_ice_db_${uuid0}.t1;
-- result:
-- !result
[UC]REFRESH MATERIALIZED VIEW test_mv2 WITH SYNC MODE;
[UC]TASK_NAME2=SELECT TASK_NAME FROM information_schema.materialized_views WHERE TABLE_SCHEMA = 'db_${uuid0}' AND TABLE_NAME='test_mv2';
-- result:
mv-0
-- !result
insert into mv_iceberg_${uuid0}.mv_ice_db_${uuid0}.t1 values ('d', 7, '2023-12-04');
-- result:
-- !result
insert into mv_iceberg_${uuid0}.mv_ice_db_${uuid0}.t1 values ('e', 8, '2023-12-05');
-- result:
-- !result
shell: sleep 2
-- result:
0

-- !result
ALTER TABLE mv_iceberg_${uuid0}.mv_ice_db_${uuid0}.t1 EXECUTE expire_snapshots(retain_last = 1);
-- result:
-- !result
[UC]REFRESH MATERIALIZED VIEW test_mv2 WITH SYNC MODE;
SELECT STATE FROM information_schema.task_runs WHERE TASK_NAME = '${TASK_NAME2}' ORDER BY FINISH_TIME DESC LIMIT 1;
-- result:
FAILED
-- !result
SELECT ERROR_MESSAGE LIKE '%snapshot ancestry broken%' FROM information_schema.task_runs WHERE TASK_NAME = '${TASK_NAME2}' ORDER BY FINISH_TIME DESC LIMIT 1;
-- result:
1
-- !result
SELECT ERROR_MESSAGE LIKE '%Drop and recreate%' FROM information_schema.task_runs WHERE TASK_NAME = '${TASK_NAME2}' ORDER BY FINISH_TIME DESC LIMIT 1;
-- result:
1
-- !result
DROP MATERIALIZED VIEW test_mv2;
-- result:
-- !result
drop table mv_iceberg_${uuid0}.mv_ice_db_${uuid0}.t1 force;
-- result:
-- !result
drop database mv_iceberg_${uuid0}.mv_ice_db_${uuid0} force;
-- result:
-- !result
drop database db_${uuid0} force;
-- result:
-- !result
