-- name: test_create_table @native
CREATE DATABASE test_create_table;
-- result:
-- !result
USE test_create_table;
-- result:
-- !result
CREATE TABLE t ( id BIGINT NOT NULL,  array_data ARRAY<int> NOT NULL, mc INT AS (array_avg(array_data)) ) Primary KEY (id) DISTRIBUTED BY HASH(id) BUCKETS 7 PROPERTIES("replication_num" = "1", "replicated_storage" = "true", "fast_schema_evolution" = "true");
-- result:
E: (1064, 'Getting analyzing error. Detail message: Illegal expression type for Generated Column Column Type: INT, Expression Type: DOUBLE.')
-- !result
CREATE TABLE t ( id BIGINT NOT NULL,  array_data ARRAY<int> NOT NULL, mc DOUBLE NOT NULL AS (array_avg(array_data)) ) Primary KEY (id) DISTRIBUTED BY HASH(id) BUCKETS 7 PROPERTIES("replication_num" = "1", "replicated_storage" = "true", "fast_schema_evolution" = "true");
-- result:
E: (1064, 'Getting syntax error. Detail message: Generated Column must be nullable column.')
-- !result
CREATE TABLE t ( id BIGINT NOT NULL,  array_data ARRAY<int> NOT NULL, mc DOUBLE AUTO_INCREMENT AS (array_avg(array_data)) ) Primary KEY (id) DISTRIBUTED BY HASH(id) BUCKETS 7 PROPERTIES("replication_num" = "1", "replicated_storage" = "true", "fast_schema_evolution" = "true");
-- result:
E: (1064, "Getting syntax error at line 1, column 95. Detail message: Unexpected input 'AS', the most similar input is {',', ')'}.")
-- !result
CREATE TABLE t ( id BIGINT NOT NULL,  array_data ARRAY<int> NOT NULL, mc DOUBLE DEFAULT "1.0" AS (array_avg(array_data)) ) Primary KEY (id) DISTRIBUTED BY HASH(id) BUCKETS 7 PROPERTIES("replication_num" = "1", "replicated_storage" = "true", "fast_schema_evolution" = "true");
-- result:
E: (1064, "Getting syntax error at line 1, column 94. Detail message: Unexpected input 'AS', the most similar input is {',', ')'}.")
-- !result
CREATE TABLE t ( id BIGINT NOT NULL,  incr BIGINT AUTO_INCREMENT, array_data ARRAY<int> NOT NULL, mc BIGINT AS (incr) ) Primary KEY (id) DISTRIBUTED BY HASH(id) BUCKETS 7 PROPERTIES("replication_num" = "1", "replicated_storage" = "true", "fast_schema_evolution" = "true");
-- result:
E: (1064, 'Getting analyzing error. Detail message: Expression can not refers to AUTO_INCREMENT columns.')
-- !result
CREATE TABLE t ( id BIGINT NOT NULL,  array_data ARRAY<int> NOT NULL, mc DOUBLE AS (array_avg(array_data)), mc_1 DOUBLE AS (mc) ) Primary KEY (id) DISTRIBUTED BY HASH(id) BUCKETS 7 PROPERTIES("replication_num" = "1", "replicated_storage" = "true", "fast_schema_evolution" = "true");
-- result:
E: (1064, 'Getting analyzing error. Detail message: Expression can not refers to other generated columns.')
-- !result
CREATE TABLE t ( id BIGINT NOT NULL,  array_data ARRAY<int> NOT NULL, mc BIGINT AS (sum(id)) ) Primary KEY (id) DISTRIBUTED BY HASH(id) BUCKETS 7 PROPERTIES("replication_num" = "1", "replicated_storage" = "true", "fast_schema_evolution" = "true");
-- result:
E: (1064, "Getting analyzing error. Detail message: Generated Column don't support aggregation function.")
-- !result
CREATE TABLE t ( id BIGINT NOT NULL,  array_data ARRAY<int> NOT NULL, mc DOUBLE AS (array_avg(array_data)), job INT NOT NULL ) Primary KEY (id) DISTRIBUTED BY HASH(id) BUCKETS 7 PROPERTIES("replication_num" = "1", "replicated_storage" = "true", "fast_schema_evolution" = "true");
-- result:
E: (1064, 'Getting analyzing error. Detail message: All generated columns must be defined after ordinary columns.')
-- !result
CREATE TABLE t ( mc INT AS (1) ) PRIMARY KEY (mc) DISTRIBUTED BY HASH(mc) BUCKETS 7 PROPERTIES("replication_num" = "1", "replicated_storage" = "true", "fast_schema_evolution" = "true");
-- result:
E: (1064, 'Getting analyzing error. Detail message: Generated Column mc can not be KEY.')
-- !result
CREATE TABLE t ( id BIGINT NOT NULL,  array_data ARRAY<int> NOT NULL, mc DOUBLE AS (array_avg(array_data)) ) Primary KEY (id) DISTRIBUTED BY HASH(id) BUCKETS 7 PROPERTIES("replication_num" = "1", "replicated_storage" = "true", "fast_schema_evolution" = "true");
-- result:
-- !result
SHOW CREATE TABLE t;
-- result:
t	CREATE TABLE `t` (
  `id` bigint(20) NOT NULL COMMENT "",
  `array_data` array<int(11)> NOT NULL COMMENT "",
  `mc` double NULL AS array_avg(array_data) COMMENT ""
) ENGINE=OLAP 
PRIMARY KEY(`id`)
DISTRIBUTED BY HASH(`id`) BUCKETS 7 
PROPERTIES (
"compression" = "LZ4",
"enable_persistent_index" = "true",
"fast_schema_evolution" = "true",
"replicated_storage" = "true",
"replication_num" = "1"
);
-- !result
DROP TABLE t;
-- result:
-- !result
DROP DATABASE test_create_table;
-- result:
-- !result
-- name: test_normal_column_schema_change @native
CREATE DATABASE test_normal_column_schema_change;
-- result:
-- !result
USE test_normal_column_schema_change;
-- result:
-- !result
CREATE TABLE t ( id BIGINT NOT NULL, name BIGINT NOT NULL, job INT NOT NULL, mc INT AS (job) ) Primary KEY (id) DISTRIBUTED BY HASH(id) BUCKETS 7 PROPERTIES("replication_num" = "1", "replicated_storage" = "true", "fast_schema_evolution" = "true");
-- result:
-- !result
ALTER TABLE t ADD COLUMN newcol INT DEFAULT "0" AFTER mc;
-- result:
E: (1064, 'Can not add column after Generated Column')
-- !result
ALTER TABLE t MODIFY COLUMN job BIGINT;
-- result:
E: (1064, 'Do not support modify column: job, because it associates with the generated column')
-- !result
ALTER TABLE t DROP COLUMN job;
-- result:
E: (1064, 'Getting analyzing error. Detail message: Column: job can not be dropped, because expression of Generated Column: mc will refer to it.')
-- !result
ALTER TABLE t MODIFY COLUMN name BIGINT AFTER mc;
-- result:
E: (1064, 'Getting analyzing error. Detail message: Can not modify column after Generated Column.')
-- !result
ALTER TABLE t ADD COLUMN newcol INT DEFAULT "0";
-- result:
-- !result
function: wait_alter_table_finish()
-- result:
None
-- !result
SHOW CREATE TABLE t;
-- result:
t	CREATE TABLE `t` (
  `id` bigint(20) NOT NULL COMMENT "",
  `name` bigint(20) NOT NULL COMMENT "",
  `job` int(11) NOT NULL COMMENT "",
  `newcol` int(11) NULL DEFAULT "0" COMMENT "",
  `mc` int(11) NULL AS job COMMENT ""
) ENGINE=OLAP 
PRIMARY KEY(`id`)
DISTRIBUTED BY HASH(`id`) BUCKETS 7 
PROPERTIES (
"compression" = "LZ4",
"enable_persistent_index" = "true",
"fast_schema_evolution" = "true",
"replicated_storage" = "true",
"replication_num" = "1"
);
-- !result
ALTER TABLE t DROP COLUMN mc;
-- result:
-- !result
function: wait_alter_table_finish()
-- result:
None
-- !result
ALTER TABLE t MODIFY COLUMN job BIGINT;
-- result:
-- !result
function: wait_alter_table_finish()
-- result:
None
-- !result
ALTER TABLE t DROP COLUMN job;
-- result:
-- !result
function: wait_alter_table_finish()
-- result:
None
-- !result
DROP TABLE t;
-- result:
-- !result
DROP DATABASE test_normal_column_schema_change;
-- result:
-- !result
-- name: test_add_multiple_column @native
CREATE DATABASE test_add_multiple_column;
-- result:
-- !result
USE test_add_multiple_column;
-- result:
-- !result
CREATE TABLE t ( id BIGINT NOT NULL ) Unique KEY (id) DISTRIBUTED BY HASH(id) BUCKETS 7 PROPERTIES("replication_num" = "1", "replicated_storage" = "true", "fast_schema_evolution" = "true");
-- result:
-- !result
INSERT INTO t VALUES (1), (2), (3);
-- result:
-- !result
ALTER TABLE t ADD COLUMN (newcol1 BIGINT AS id * 10, newcol2 BIGINT AS id * 100);
-- result:
-- !result
function: wait_alter_table_finish()
-- result:
None
-- !result
SELECT * FROM t ORDER BY id;
-- result:
1	10	100
2	20	200
3	30	300
-- !result
SHOW CREATE TABLE t;
-- result:
t	CREATE TABLE `t` (
  `id` bigint(20) NOT NULL COMMENT "",
  `newcol1` bigint(20) NULL AS `id` * 10 COMMENT "",
  `newcol2` bigint(20) NULL AS `id` * 100 COMMENT ""
) ENGINE=OLAP 
UNIQUE KEY(`id`)
DISTRIBUTED BY HASH(`id`) BUCKETS 7 
PROPERTIES (
"compression" = "LZ4",
"fast_schema_evolution" = "true",
"replicated_storage" = "true",
"replication_num" = "1"
);
-- !result
ALTER TABLE t ADD COLUMN (newcol3 BIGINT DEFAULT "0", newcol4 BIGINT DEFAULT "0");
-- result:
-- !result
function: wait_alter_table_finish()
-- result:
None
-- !result
SELECT * FROM t ORDER BY id;
-- result:
1	0	0	10	100
2	0	0	20	200
3	0	0	30	300
-- !result
SHOW CREATE TABLE t;
-- result:
t	CREATE TABLE `t` (
  `id` bigint(20) NOT NULL COMMENT "",
  `newcol3` bigint(20) NULL DEFAULT "0" COMMENT "",
  `newcol4` bigint(20) NULL DEFAULT "0" COMMENT "",
  `newcol1` bigint(20) NULL AS `id` * 10 COMMENT "",
  `newcol2` bigint(20) NULL AS `id` * 100 COMMENT ""
) ENGINE=OLAP 
UNIQUE KEY(`id`)
DISTRIBUTED BY HASH(`id`) BUCKETS 7 
PROPERTIES (
"compression" = "LZ4",
"fast_schema_evolution" = "true",
"replicated_storage" = "true",
"replication_num" = "1"
);
-- !result
ALTER TABLE t ADD COLUMN (newcol5 BIGINT DEFAULT "0", newcol6 BIGINT AS id * 1000);
-- result:
E: (1064, 'Getting analyzing error. Detail message: Can not add normal column and Generated Column in the same time.')
-- !result
DROP DATABASE test_add_multiple_column;
-- result:
-- !result
-- name: test_materialized_column_update
CREATE DATABASE test_update;
-- result:
-- !result
USE test_update;
-- result:
-- !result
CREATE TABLE t ( id BIGINT NOT NULL, v1 BIGINT NOT NULL, v2 BIGINT NOT NULL, v3 BIGINT AS v2) Primary KEY (id) DISTRIBUTED BY HASH(id) BUCKETS 7 PROPERTIES("replication_num" = "1", "replicated_storage" = "true", "fast_schema_evolution" = "true");
-- result:
-- !result
INSERT INTO t VALUES (1, 2, 3);
-- result:
-- !result
SET partial_update_mode = "row";
-- result:
-- !result
UPDATE t SET v1 = 100 where id = 1;
-- result:
-- !result
SELECT * FROM t;
-- result:
1	100	3	3
-- !result
UPDATE t SET v1 = 200 where v3 = 3;
-- result:
-- !result
SELECT * FROM t;
-- result:
1	200	3	3
-- !result
UPDATE t SET v2 = 300 where v3 = 3;
-- result:
-- !result
SELECT * FROM t;
-- result:
1	200	300	300
-- !result
UPDATE t SET v2 = 400 where v3 = 300;
-- result:
-- !result
SELECT * FROM t;
-- result:
1	200	400	400
-- !result
INSERT INTO t VALUES (1, 2, 3);
-- result:
-- !result
SET partial_update_mode = "column";
-- result:
-- !result
UPDATE t SET v1 = 100 where id = 1;
-- result:
E: (1064, 'Getting analyzing error. Detail message: All ref Column must be sepecfied in partial update mode.')
-- !result
SELECT * FROM t;
-- result:
1	2	3	3
-- !result
UPDATE t SET v1 = 200 where v3 = 3;
-- result:
E: (1064, 'Getting analyzing error. Detail message: All ref Column must be sepecfied in partial update mode.')
-- !result
SELECT * FROM t;
-- result:
1	2	3	3
-- !result
UPDATE t SET v2 = 300 where v3 = 3;
-- result:
-- !result
SELECT * FROM t;
-- result:
1	2	300	300
-- !result
UPDATE t SET v2 = 400 where v3 = 300;
-- result:
-- !result
SELECT * FROM t;
-- result:
1	2	400	400
-- !result
DROP DATABASE test_update FORCE;
-- result:
-- !result
-- name: test_schema_change_for_after @native
CREATE DATABASE test_schema_change_for_after;
-- result:
-- !result
USE test_schema_change_for_after;
-- result:
-- !result
CREATE TABLE t0 ( v1 BIGINT NOT NULL, v2 BIGINT NOT NULL, v3 BIGINT NOT NULL) DUPLICATE KEY (v1) DISTRIBUTED BY HASH(v1) BUCKETS 1 PROPERTIES("replication_num" = "1", "replicated_storage" = "true", "fast_schema_evolution" = "true");
-- result:
-- !result
alter table t0 add column testcol1 BIGINT after xxx, add column testcol2 BIGINT after testcol1;
-- result:
E: (1064, 'Column[xxx] does not found')
-- !result
alter table t0 add column testcol1 BIGINT after v1, add column testcol2 BIGINT after xxx;
-- result:
E: (1064, 'Column[xxx] does not found')
-- !result
alter table t0 add column testcol1 BIGINT after xxx, add column testcol2 BIGINT after xxx;
-- result:
E: (1064, 'Column[xxx] does not found')
-- !result
alter table t0 add column testcol1 BIGINT as v1 + 10 after xxx, add column testcol2 BIGINT after xxx;
-- result:
E: (1064, 'Getting syntax error from line 1, column 26 to line 1, column 50. Detail message: AFTER can not be set when ADD GENERATED COLUMN.')
-- !result
alter table t0 add column testcol1 BIGINT as v1 + 10 after v1, add column testcol2 BIGINT after v1;
-- result:
E: (1064, 'Getting syntax error from line 1, column 26 to line 1, column 50. Detail message: AFTER can not be set when ADD GENERATED COLUMN.')
-- !result
alter table t0 add column testcol1 BIGINT as v1 + 10, add column testcol2 BIGINT after testcol1;
-- result:
E: (1064, 'Can not add column after Generated Column')
-- !result
alter table t0 add column testcol1 BIGINT after v1, add column testcol2 BIGINT after testcol1;
-- result:
-- !result
function: wait_alter_table_finish()
-- result:
None
-- !result
SHOW CREATE TABLE t0;
-- result:
t0	CREATE TABLE `t0` (
  `v1` bigint(20) NOT NULL COMMENT "",
  `testcol1` bigint(20) NULL COMMENT "",
  `testcol2` bigint(20) NULL COMMENT "",
  `v2` bigint(20) NOT NULL COMMENT "",
  `v3` bigint(20) NOT NULL COMMENT ""
) ENGINE=OLAP 
DUPLICATE KEY(`v1`)
DISTRIBUTED BY HASH(`v1`) BUCKETS 1 
PROPERTIES (
"compression" = "LZ4",
"fast_schema_evolution" = "true",
"replicated_storage" = "true",
"replication_num" = "1"
);
-- !result
alter table t0 add column testcol3 BIGINT after v1, add column testcol4 BIGINT after v1;
-- result:
-- !result
function: wait_alter_table_finish()
-- result:
None
-- !result
SHOW CREATE TABLE t0;
-- result:
t0	CREATE TABLE `t0` (
  `v1` bigint(20) NOT NULL COMMENT "",
  `testcol4` bigint(20) NULL COMMENT "",
  `testcol3` bigint(20) NULL COMMENT "",
  `testcol1` bigint(20) NULL COMMENT "",
  `testcol2` bigint(20) NULL COMMENT "",
  `v2` bigint(20) NOT NULL COMMENT "",
  `v3` bigint(20) NOT NULL COMMENT ""
) ENGINE=OLAP 
DUPLICATE KEY(`v1`)
DISTRIBUTED BY HASH(`v1`) BUCKETS 1 
PROPERTIES (
"compression" = "LZ4",
"fast_schema_evolution" = "true",
"replicated_storage" = "true",
"replication_num" = "1"
);
-- !result
alter table t0 add column testcol5 BIGINT, add column testcol6 BIGINT as v1 * 10;
-- result:
-- !result
function: wait_alter_table_finish()
-- result:
None
-- !result
SHOW CREATE TABLE t0;
-- result:
t0	CREATE TABLE `t0` (
  `v1` bigint(20) NOT NULL COMMENT "",
  `testcol4` bigint(20) NULL COMMENT "",
  `testcol3` bigint(20) NULL COMMENT "",
  `testcol1` bigint(20) NULL COMMENT "",
  `testcol2` bigint(20) NULL COMMENT "",
  `v2` bigint(20) NOT NULL COMMENT "",
  `v3` bigint(20) NOT NULL COMMENT "",
  `testcol5` bigint(20) NULL COMMENT "",
  `testcol6` bigint(20) NULL AS `v1` * 10 COMMENT ""
) ENGINE=OLAP 
DUPLICATE KEY(`v1`)
DISTRIBUTED BY HASH(`v1`) BUCKETS 1 
PROPERTIES (
"compression" = "LZ4",
"fast_schema_evolution" = "true",
"replicated_storage" = "true",
"replication_num" = "1"
);
-- !result
DROP DATABASE test_schema_change_for_after;
-- result:
-- !result
-- name: test_add_normal_and_generated_column_with_data @native
CREATE DATABASE test_add_normal_and_generated_column_with_data;
-- result:
-- !result
USE test_add_normal_and_generated_column_with_data;
-- result:
-- !result
CREATE TABLE t0 ( v1 BIGINT NOT NULL, v2 BIGINT NOT NULL) DUPLICATE KEY (v1) DISTRIBUTED BY HASH(v1) BUCKETS 1 PROPERTIES("replication_num" = "1", "replicated_storage" = "true", "fast_schema_evolution" = "true");
-- result:
-- !result
INSERT INTO t0 VALUES (1, 1), (2, 2), (3, 3);
-- result:
-- !result
alter table t0 add column testcol1 BIGINT, add column testcol2 BIGINT as v1 * 10;
-- result:
-- !result
function: wait_alter_table_finish()
-- result:
None
-- !result
SHOW CREATE TABLE t0;
-- result:
t0	CREATE TABLE `t0` (
  `v1` bigint(20) NOT NULL COMMENT "",
  `v2` bigint(20) NOT NULL COMMENT "",
  `testcol1` bigint(20) NULL COMMENT "",
  `testcol2` bigint(20) NULL AS `v1` * 10 COMMENT ""
) ENGINE=OLAP 
DUPLICATE KEY(`v1`)
DISTRIBUTED BY HASH(`v1`) BUCKETS 1 
PROPERTIES (
"compression" = "LZ4",
"fast_schema_evolution" = "true",
"replicated_storage" = "true",
"replication_num" = "1"
);
-- !result
SELECT * FROM t0 ORDER BY v1;
-- result:
1	1	None	10
2	2	None	20
3	3	None	30
-- !result
alter table t0 add column testcol3 BIGINT, add column testcol4 BIGINT as v1 * 100, add column testcol5 BIGINT as v1 * 1000;
-- result:
-- !result
function: wait_alter_table_finish()
-- result:
None
-- !result
SELECT * FROM t0 ORDER BY v1;
-- result:
1	1	None	None	10	100	1000
2	2	None	None	20	200	2000
3	3	None	None	30	300	3000
-- !result
DROP DATABASE test_add_normal_and_generated_column_with_data;
-- result:
-- !result
-- name: test_compaction_after_adding_generated_column @native
CREATE DATABASE test_compaction_after_adding_generated_column;
-- result:
-- !result
USE test_compaction_after_adding_generated_column;
-- result:
-- !result
CREATE TABLE `t` (
  `c1` BIGINT NOT NULL COMMENT "",
  `c2` BIGINT NOT NULL COMMENT "",
  `c3` BIGINT as `c1` + `c2`
) ENGINE=OLAP 
PRIMARY KEY(`c1`)
DISTRIBUTED BY HASH(`c1`) BUCKETS 1
PROPERTIES (
"compression" = "LZ4",
"replicated_storage" = "true",
"replication_num" = "1"
);
-- result:
-- !result
INSERT INTO t values (1,1),(2,2),(3,3),(4,4);
-- result:
-- !result
ALTER TABLE t drop column c3;
-- result:
-- !result
INSERT INTO t values (1,1),(2,2),(3,3),(4,4);
-- result:
-- !result
ALTER TABLE t add column c4 BIGINT as c1 + c2 + 10;
-- result:
-- !result
function: wait_alter_table_finish()
-- result:
None
-- !result
SELECT sleep(10);
-- result:
1
-- !result
[UC]ALTER TABLE t COMPACT;
-- result:
-- !result
SELECT sleep(30);
-- result:
1
-- !result
SELECT * FROM t;
-- result:
1	1	12
2	2	14
3	3	16
4	4	18
-- !result
DROP DATABASE test_compaction_after_adding_generated_column;
-- result:
-- !result
-- name: test_fix_adding_and_col_partial_update_conflict @native
CREATE TABLE t_fix_adding_and_col_partial_update_conflict ( id BIGINT NOT NULL, v1 BIGINT NOT NULL, v2 BIGINT NOT NULL) Primary KEY (id) DISTRIBUTED BY HASH(id) BUCKETS 1 PROPERTIES("replication_num" = "1", "replicated_storage" = "true", "fast_schema_evolution" = "true");
-- result:
-- !result
insert into t_fix_adding_and_col_partial_update_conflict values (1,2,3),(2,3,4),(3,4,5);
-- result:
-- !result
SET partial_update_mode = "column";
-- result:
-- !result
UPDATE t_fix_adding_and_col_partial_update_conflict SET v2 = 400 where id = 2;
-- result:
-- !result
delete from t_fix_adding_and_col_partial_update_conflict where id % 2 = 1;
-- result:
-- !result
alter table t_fix_adding_and_col_partial_update_conflict add column newcol bigint as v2 * 100;
-- result:
-- !result
function: wait_alter_table_finish()
-- result:
None
-- !result
select * from t_fix_adding_and_col_partial_update_conflict;
-- result:
2	3	400	40000
-- !result
drop table t_fix_adding_and_col_partial_update_conflict;
-- result:
-- !result
