-- name: test_create_table
CREATE DATABASE test_create_table;
-- result:
-- !result
USE test_create_table;
-- result:
-- !result
CREATE TABLE t ( id BIGINT NOT NULL,  array_data ARRAY<int> NOT NULL, mc INT AS (array_avg(array_data)) ) Primary KEY (id) DISTRIBUTED BY HASH(id) BUCKETS 7 PROPERTIES("replication_num" = "1");
-- result:
E: (1064, 'Getting analyzing error. Detail message: Illege expression type for Materialized Column Column Type: INT, Expression Type: DOUBLE.')
-- !result
CREATE TABLE t ( id BIGINT NOT NULL,  array_data ARRAY<int> NOT NULL, mc DOUBLE NOT NULL AS (array_avg(array_data)) ) Primary KEY (id) DISTRIBUTED BY HASH(id) BUCKETS 7 PROPERTIES("replication_num" = "1");
-- result:
E: (1064, 'Getting syntax error. Detail message: Materialized Column must be nullable column.')
-- !result
CREATE TABLE t ( id BIGINT NOT NULL,  array_data ARRAY<int> NOT NULL, mc DOUBLE AUTO_INCREMENT AS (array_avg(array_data)) ) Primary KEY (id) DISTRIBUTED BY HASH(id) BUCKETS 7 PROPERTIES("replication_num" = "1");
-- result:
E: (1064, "Getting syntax error at line 1, column 95. Detail message: Unexpected input 'AS', the most similar input is {',', ')'}.")
-- !result
CREATE TABLE t ( id BIGINT NOT NULL,  array_data ARRAY<int> NOT NULL, mc DOUBLE DEFAULT "1.0" AS (array_avg(array_data)) ) Primary KEY (id) DISTRIBUTED BY HASH(id) BUCKETS 7 PROPERTIES("replication_num" = "1");
-- result:
E: (1064, "Getting syntax error at line 1, column 94. Detail message: Unexpected input 'AS', the most similar input is {',', ')'}.")
-- !result
CREATE TABLE t ( id BIGINT NOT NULL,  incr BIGINT AUTO_INCREMENT, array_data ARRAY<int> NOT NULL, mc BIGINT AS (incr) ) Primary KEY (id) DISTRIBUTED BY HASH(id) BUCKETS 7 PROPERTIES("replication_num" = "1");
-- result:
E: (1064, 'Getting analyzing error. Detail message: Expression can not refers to AUTO_INCREMENT columns.')
-- !result
CREATE TABLE t ( id BIGINT NOT NULL,  array_data ARRAY<int> NOT NULL, mc DOUBLE AS (array_avg(array_data)), mc_1 DOUBLE AS (mc) ) Primary KEY (id) DISTRIBUTED BY HASH(id) BUCKETS 7 PROPERTIES("replication_num" = "1");
-- result:
E: (1064, 'Getting analyzing error. Detail message: Expression can not refers to other materialized columns.')
-- !result
CREATE TABLE t ( id BIGINT NOT NULL,  array_data ARRAY<int> NOT NULL, mc BIGINT AS (sum(id)) ) Primary KEY (id) DISTRIBUTED BY HASH(id) BUCKETS 7 PROPERTIES("replication_num" = "1");
-- result:
E: (1064, "Getting analyzing error. Detail message: Materialized Column don't support aggregation function.")
-- !result
CREATE TABLE t ( id BIGINT NOT NULL,  array_data ARRAY<int> NOT NULL, mc DOUBLE AS (array_avg(array_data)), job INT NOT NULL ) Primary KEY (id) DISTRIBUTED BY HASH(id) BUCKETS 7 PROPERTIES("replication_num" = "1");
-- result:
E: (1064, 'Getting analyzing error. Detail message: All materialized columns must be defined after ordinary columns.')
-- !result
CREATE TABLE t ( mc INT AS (1) ) PRIMARY KEY (mc) DISTRIBUTED BY HASH(mc) BUCKETS 7 PROPERTIES("replication_num" = "1");
-- result:
E: (1064, 'Getting analyzing error. Detail message: Materialized Column can not be KEY.')
-- !result
CREATE TABLE t ( id BIGINT NOT NULL,  array_data ARRAY<int> NOT NULL, mc DOUBLE AS (array_avg(array_data)) ) Primary KEY (id) DISTRIBUTED BY HASH(id) BUCKETS 7 PROPERTIES("replication_num" = "1");
-- result:
-- !result
SHOW CREATE TABLE t;
-- result:
t	CREATE TABLE `t` (
  `id` bigint(20) NOT NULL COMMENT "",
  `array_data` array<int(11)> NOT NULL COMMENT "",
  `mc` double NULL AS array_avg(array_data) COMMENT ""
) ENGINE=OLAP 
PRIMARY KEY(`id`)
DISTRIBUTED BY HASH(`id`) BUCKETS 7 
PROPERTIES (
"replication_num" = "1",
"in_memory" = "false",
"enable_persistent_index" = "false",
"replicated_storage" = "true",
"compression" = "LZ4"
);
-- !result
DROP TABLE t;
-- result:
-- !result
DROP DATABASE test_create_table;
-- result:
-- !result
-- name: test_materialized_column_insert
CREATE DATABASE test_insert;
-- result:
-- !result
USE test_insert;
-- result:
-- !result
CREATE TABLE t ( id BIGINT NOT NULL,  array_data ARRAY<int> NOT NULL, mc DOUBLE AS (array_avg(array_data)) ) Primary KEY (id) DISTRIBUTED BY HASH(id) BUCKETS 7 PROPERTIES("replication_num" = "1");
-- result:
-- !result
INSERT INTO t VALUES (1, [1,2], 0.0);
-- result:
E: (1064, "Getting analyzing error. Detail message: Column count doesn't match value count.")
-- !result
INSERT INTO t (id, array_data, mc) VALUES (1, [1,2], 0.0);
-- result:
E: (1064, "Getting analyzing error. Detail message: materialized column 'mc' can not be specified.")
-- !result
INSERT INTO t VALUES (1, [1,2]);
-- result:
-- !result
INSERT INTO t (id, array_data) VALUES (2, [3,4]);
-- result:
-- !result
CREATE TABLE t1 ( id BIGINT NOT NULL,  array_data ARRAY<int> NOT NULL, mc DOUBLE AS (array_avg(array_data)) ) Primary KEY (id) DISTRIBUTED BY HASH(id) BUCKETS 7 PROPERTIES("replication_num" = "1");
-- result:
-- !result
INSERT INTO t1 VALUES (3, [10,20]);
-- result:
-- !result
INSERT INTO t1 (id, array_data) VALUES (4, [30,40]);
-- result:
-- !result
INSERT INTO t SELECT id, array_data FROM t1;
-- result:
-- !result
SELECT * FROM t ORDER BY id;
-- result:
1	[1,2]	1.5
2	[3,4]	3.5
3	[10,20]	15.0
4	[30,40]	35.0
-- !result
DROP TABLE t;
-- result:
-- !result
DROP TABLE t1;
-- result:
-- !result
DROP DATABASE test_insert;
-- result:
-- !result
-- name: test_materialized_column_in_materialized_view
CREATE DATABASE test_materialized_column_in_materialized_view;
-- result:
-- !result
USE test_materialized_column_in_materialized_view;
-- result:
-- !result
CREATE TABLE t ( id BIGINT NOT NULL, mc BIGINT AS (id) ) Unique KEY (id) DISTRIBUTED BY HASH(id) BUCKETS 7 PROPERTIES("replication_num" = "1");
-- result:
-- !result
CREATE MATERIALIZED VIEW mv1 DISTRIBUTED BY HASH(id) BUCKETS 10 REFRESH ASYNC AS SELECT id, mc FROM t;
-- result:
-- !result
INSERT INTO t VALUES (1);
-- result:
-- !result
SELECT * FROM t;
-- result:
1	1
-- !result
select sleep(5);
-- result:
1
-- !result
SELECT * FROM mv1;
-- result:
1	1
-- !result
ALTER TABLE t modify COLUMN mc BIGINT AS (id);
-- result:
-- !result
function: wait_alter_table_finish()
-- result:
None
-- !result
REFRESH MATERIALIZED VIEW mv1;
-- result:
E: (1064, 'Getting analyzing error at line 1, column 26. Detail message: Refresh materialized view failed because [mv1] is not active. You can try to active it with ALTER MATERIALIZED VIEW mv1 ACTIVE; .')
-- !result
select sleep(5);
-- result:
1
-- !result
SELECT * FROM mv1;
-- result:
1	1
-- !result
DROP TABLE t;
-- result:
-- !result
DROP DATABASE test_materialized_column_in_materialized_view;
-- result:
-- !result
-- name: test_materialized_column_alter_table_with_concurrent_insert
CREATE DATABASE test_materialized_column_alter_table_with_concurrent_insert;
-- result:
-- !result
USE test_materialized_column_alter_table_with_concurrent_insert;
-- result:
-- !result
CREATE TABLE t ( id BIGINT NOT NULL, mc BIGINT AS (id) ) Unique KEY (id) DISTRIBUTED BY HASH(id) BUCKETS 7 PROPERTIES("replication_num" = "1");
-- result:
-- !result
ALTER TABLE t MODIFY COLUMN mc BIGINT AS (id + 10);
-- result:
-- !result
INSERT INTO t VALUES (1);
-- result:
-- !result
INSERT INTO t VALUES (2);
-- result:
-- !result
INSERT INTO t VALUES (3);
-- result:
-- !result
INSERT INTO t VALUES (4);
-- result:
-- !result
INSERT INTO t VALUES (5);
-- result:
-- !result
SELECT * FROM t ORDER BY id;
-- result:
1	1
2	2
3	3
4	4
5	5
-- !result
function: wait_alter_table_finish()
-- result:
None
-- !result
SELECT * FROM t ORDER BY id;
-- result:
1	11
2	12
3	13
4	14
5	15
-- !result
DROP TABLE t;
-- result:
-- !result
CREATE TABLE t ( id BIGINT NOT NULL, mc BIGINT AS (id) ) Unique KEY (id) DISTRIBUTED BY HASH(id) BUCKETS 7 PROPERTIES("replication_num" = "1");
-- result:
-- !result
ALTER TABLE t DROP COLUMN mc;
-- result:
-- !result
INSERT INTO t VALUES (1);
-- result:
-- !result
INSERT INTO t VALUES (2);
-- result:
-- !result
INSERT INTO t VALUES (3);
-- result:
-- !result
INSERT INTO t VALUES (4);
-- result:
-- !result
INSERT INTO t VALUES (5);
-- result:
-- !result
SELECT * FROM t ORDER BY id;
-- result:
1	1
2	2
3	3
4	4
5	5
-- !result
function: wait_alter_table_finish()
-- result:
None
-- !result
SELECT * FROM t ORDER BY id;
-- result:
1
2
3
4
5
-- !result
DROP TABLE t;
-- result:
-- !result
CREATE TABLE t ( id BIGINT NOT NULL, mc BIGINT AS (id) ) Unique KEY (id) DISTRIBUTED BY HASH(id) BUCKETS 7 PROPERTIES("replication_num" = "1");
-- result:
-- !result
ALTER TABLE t ADD COLUMN name BIGINT AS (id + 10);
-- result:
-- !result
INSERT INTO t VALUES (1);
-- result:
-- !result
INSERT INTO t VALUES (2);
-- result:
-- !result
INSERT INTO t VALUES (3);
-- result:
-- !result
INSERT INTO t VALUES (4);
-- result:
-- !result
INSERT INTO t VALUES (5);
-- result:
-- !result
SELECT * FROM t ORDER BY id;
-- result:
1	1
2	2
3	3
4	4
5	5
-- !result
function: wait_alter_table_finish()
-- result:
None
-- !result
SELECT * FROM t ORDER BY id;
-- result:
1	1	11
2	2	12
3	3	13
4	4	14
5	5	15
-- !result
DROP TABLE t;
-- result:
-- !result
DROP DATABASE test_materialized_column_alter_table_with_concurrent_insert;
-- result:
-- !result
-- name: test_materialized_column_schema_change
CREATE DATABASE test_materialized_column_schema_change;
-- result:
-- !result
USE test_materialized_column_schema_change;
-- result:
-- !result
CREATE TABLE t ( id BIGINT NOT NULL, job INT NOT NULL, incr BIGINT AUTO_INCREMENT, array_data ARRAY<int> NOT NULL ) Primary KEY (id) DISTRIBUTED BY HASH(id) BUCKETS 7 PROPERTIES("replication_num" = "1");
-- result:
-- !result
INSERT INTO t VALUES (1, 2, DEFAULT, [1,2]);
-- result:
-- !result
ALTER TABLE t ADD COLUMN mc_1 DOUBLE AS (array_avg(array_data));
-- result:
-- !result
function: wait_alter_table_finish()
-- result:
None
-- !result
ALTER TABLE t ADD COLUMN mc_2 INT AS (job);
-- result:
-- !result
function: wait_alter_table_finish()
-- result:
None
-- !result
SELECT * FROM t ORDER BY id;
-- result:
1	2	1	[1,2]	1.5	2
-- !result
ALTER TABLE t ADD COLUMN mc_3 INT AS (array_avg(array_data));
-- result:
E: (1064, 'Getting analyzing error. Detail message: Illege expression type for Materialized Column Column Type: INT, Expression Type: DOUBLE.')
-- !result
ALTER TABLE t ADD COLUMN mc_3 DOUBLE AS NOT NULL (array_avg(array_data));
-- result:
E: (1064, "Getting syntax error at line 1, column 49. Detail message: Unexpected input '(', the most similar input is {<EOF>, ';'}.")
-- !result
ALTER TABLE t ADD COLUMN mc_3 DOUBLE AS AUTO_INCREMENT (array_avg(array_data));
-- result:
E: (1064, 'Getting analyzing error from line 1, column 40 to line 1, column 77. Detail message: No matching function with signature: auto_increment(double).')
-- !result
ALTER TABLE t ADD COLUMN mc_3 DOUBLE AS DEFAULT "1.0" (array_avg(array_data));
-- result:
E: (1064, "Getting syntax error at line 1, column 40. Detail message: Unexpected input 'DEFAULT', the most similar input is {a legal identifier}.")
-- !result
ALTER TABLE t ADD COLUMN mc_3 DOUBLE AS (mc_1);
-- result:
E: (1064, 'Getting analyzing error. Detail message: Expression can not refers to other materialized columns.')
-- !result
ALTER TABLE t ADD COLUMN mc_3 BIGINT AS (sum(id));
-- result:
E: (1064, "Getting analyzing error. Detail message: Materialized Column don't support aggregation function.")
-- !result
ALTER TABLE t ADD COLUMN mc_3 BIGINT KEY AS (id);
-- result:
E: (1064, 'Getting syntax error. Detail message: Materialized Column can not be KEY.')
-- !result
ALTER TABLE t MODIFY COLUMN mc_1 ARRAY<int> AS (array_sort(array_data));
-- result:
-- !result
function: wait_alter_table_finish()
-- result:
None
-- !result
SELECT * FROM t ORDER BY id;
-- result:
1	2	1	[1,2]	[1,2]	2
-- !result
ALTER TABLE t MODIFY COLUMN mc_1 INT AS (array_avg(array_data));
-- result:
E: (1064, 'Getting analyzing error. Detail message: Illege expression type for Materialized Column Column Type: INT, Expression Type: DOUBLE.')
-- !result
ALTER TABLE t MODIFY COLUMN mc_1 DOUBLE AS NOT NULL (array_avg(array_data));
-- result:
E: (1064, "Getting syntax error at line 1, column 52. Detail message: Unexpected input '(', the most similar input is {<EOF>, ';'}.")
-- !result
ALTER TABLE t MODIFY COLUMN mc_1 DOUBLE AS AUTO_INCREMENT (array_avg(array_data));
-- result:
E: (1064, 'Getting analyzing error from line 1, column 43 to line 1, column 80. Detail message: No matching function with signature: auto_increment(double).')
-- !result
ALTER TABLE t MODIFY COLUMN mc_1 DOUBLE AS DEFAULT "1.0" (array_avg(array_data));
-- result:
E: (1064, "Getting syntax error at line 1, column 43. Detail message: Unexpected input 'DEFAULT', the most similar input is {a legal identifier}.")
-- !result
ALTER TABLE t MODIFY COLUMN mc_1 DOUBLE AS (mc_2);
-- result:
E: (1064, 'Getting analyzing error. Detail message: Expression can not refers to other materialized columns.')
-- !result
ALTER TABLE t MODIFY COLUMN mc_1 BIGINT AS (sum(id));
-- result:
E: (1064, "Getting analyzing error. Detail message: Materialized Column don't support aggregation function.")
-- !result
ALTER TABLE t MODIFY COLUMN mc_1 BIGINT AS (incr);
-- result:
E: (1064, 'Getting analyzing error. Detail message: Expression can not refers to AUTO_INCREMENT columns.')
-- !result
ALTER TABLE t MODIFY COLUMN mc_1 BIGINT KEY AS (id);
-- result:
E: (1064, 'Getting syntax error. Detail message: Materialized Column can not be KEY.')
-- !result
ALTER TABLE t MODIFY COLUMN mc_2 INT;
-- result:
E: (1064, 'Unexpected exception: Can not modify a materialized column to a non-materialized column')
-- !result
ALTER TABLE t MODIFY COLUMN job BIGINT AS (id);
-- result:
E: (1064, 'Unexpected exception: Can not modify a non-materialized column to a materialized column')
-- !result
ALTER TABLE t DROP COLUMN mc_2;
-- result:
-- !result
function: wait_alter_table_finish()
-- result:
None
-- !result
DROP TABLE t;
-- result:
-- !result
DROP DATABASE test_materialized_column_schema_change;
-- result:
-- !result
-- name: test_normal_column_schema_change
CREATE DATABASE test_normal_column_schema_change;
-- result:
-- !result
USE test_normal_column_schema_change;
-- result:
-- !result
CREATE TABLE t ( id BIGINT NOT NULL, name BIGINT NOT NULL, job INT NOT NULL, mc INT AS (job) ) Primary KEY (id) DISTRIBUTED BY HASH(id) BUCKETS 7 PROPERTIES("replication_num" = "1");
-- result:
-- !result
ALTER TABLE t ADD COLUMN newcol INT DEFAULT "0" AFTER mc;
-- result:
E: (1064, 'Getting analyzing error. Detail message: Can not add column after Materialized Column.')
-- !result
ALTER TABLE t MODIFY COLUMN job BIGINT;
-- result:
E: (1064, 'Unexpected exception: Do not support modify column: job, because it associates with the materialized column')
-- !result
ALTER TABLE t DROP COLUMN job;
-- result:
E: (1064, 'Getting analyzing error. Detail message: Column: job can not be dropped, because expression of Materialized Column: mc will refer to it.')
-- !result
ALTER TABLE t MODIFY COLUMN name BIGINT AFTER mc;
-- result:
E: (1064, 'Getting analyzing error. Detail message: Can not modify column after Materialized Column.')
-- !result
ALTER TABLE t ADD COLUMN newcol INT DEFAULT "0";
-- result:
-- !result
function: wait_alter_table_finish()
-- result:
None
-- !result
SHOW CREATE TABLE t;
-- result:
t	CREATE TABLE `t` (
  `id` bigint(20) NOT NULL COMMENT "",
  `name` bigint(20) NOT NULL COMMENT "",
  `job` int(11) NOT NULL COMMENT "",
  `newcol` int(11) NULL DEFAULT "0" COMMENT "",
  `mc` int(11) NULL AS job COMMENT ""
) ENGINE=OLAP 
PRIMARY KEY(`id`)
DISTRIBUTED BY HASH(`id`) BUCKETS 7 
PROPERTIES (
"replication_num" = "1",
"in_memory" = "false",
"enable_persistent_index" = "false",
"replicated_storage" = "true",
"compression" = "LZ4"
);
-- !result
ALTER TABLE t DROP COLUMN mc;
-- result:
-- !result
function: wait_alter_table_finish()
-- result:
None
-- !result
ALTER TABLE t MODIFY COLUMN job BIGINT;
-- result:
-- !result
function: wait_alter_table_finish()
-- result:
None
-- !result
ALTER TABLE t DROP COLUMN job;
-- result:
-- !result
function: wait_alter_table_finish()
-- result:
None
-- !result
DROP TABLE t;
-- result:
-- !result
DROP DATABASE test_normal_column_schema_change;
-- result:
-- !result
-- name: test_add_multiple_column
CREATE DATABASE test_add_multiple_column;
-- result:
-- !result
USE test_add_multiple_column;
-- result:
-- !result
CREATE TABLE t ( id BIGINT NOT NULL ) Unique KEY (id) DISTRIBUTED BY HASH(id) BUCKETS 7 PROPERTIES("replication_num" = "1");
-- result:
-- !result
INSERT INTO t VALUES (1), (2), (3);
-- result:
-- !result
ALTER TABLE t ADD COLUMN (newcol1 BIGINT AS id * 10, newcol2 BIGINT AS id * 100);
-- result:
-- !result
function: wait_alter_table_finish()
-- result:
None
-- !result
SELECT * FROM t ORDER BY id;
-- result:
1	10	100
2	20	200
3	30	300
-- !result
SHOW CREATE TABLE t;
-- result:
t	CREATE TABLE `t` (
  `id` bigint(20) NOT NULL COMMENT "",
  `newcol1` bigint(20) NULL AS `test_add_multiple_column`.`t`.`id` * 10 COMMENT "",
  `newcol2` bigint(20) NULL AS `test_add_multiple_column`.`t`.`id` * 100 COMMENT ""
) ENGINE=OLAP 
UNIQUE KEY(`id`)
DISTRIBUTED BY HASH(`id`) BUCKETS 7 
PROPERTIES (
"replication_num" = "1",
"in_memory" = "false",
"enable_persistent_index" = "false",
"replicated_storage" = "true",
"compression" = "LZ4"
);
-- !result
ALTER TABLE t ADD COLUMN (newcol3 BIGINT DEFAULT "0", newcol4 BIGINT DEFAULT "0");
-- result:
-- !result
function: wait_alter_table_finish()
-- result:
None
-- !result
SELECT * FROM t ORDER BY id;
-- result:
1	0	0	10	100
2	0	0	20	200
3	0	0	30	300
-- !result
SHOW CREATE TABLE t;
-- result:
t	CREATE TABLE `t` (
  `id` bigint(20) NOT NULL COMMENT "",
  `newcol3` bigint(20) NULL DEFAULT "0" COMMENT "",
  `newcol4` bigint(20) NULL DEFAULT "0" COMMENT "",
  `newcol1` bigint(20) NULL AS `test_add_multiple_column`.`t`.`id` * 10 COMMENT "",
  `newcol2` bigint(20) NULL AS `test_add_multiple_column`.`t`.`id` * 100 COMMENT ""
) ENGINE=OLAP 
UNIQUE KEY(`id`)
DISTRIBUTED BY HASH(`id`) BUCKETS 7 
PROPERTIES (
"replication_num" = "1",
"in_memory" = "false",
"enable_persistent_index" = "false",
"replicated_storage" = "true",
"compression" = "LZ4"
);
-- !result
ALTER TABLE t ADD COLUMN (newcol5 BIGINT DEFAULT "0", newcol6 BIGINT AS id * 1000);
-- result:
E: (1064, 'Getting analyzing error. Detail message: Can not add normal column and Materialized Column in the same time.')
-- !result
DROP DATABASE test_add_multiple_column;
-- result:
-- !result
-- name: test_materialized_column_update
CREATE DATABASE test_update;
-- result:
-- !result
USE test_update;
-- result:
-- !result
CREATE TABLE t ( id BIGINT NOT NULL, v1 BIGINT NOT NULL, v2 BIGINT NOT NULL, v3 BIGINT AS v2) Primary KEY (id) DISTRIBUTED BY HASH(id) BUCKETS 7 PROPERTIES("replication_num" = "1");
-- result:
-- !result
INSERT INTO t VALUES (1, 2, 3);
-- result:
-- !result
SET partial_update_mode = "row";
-- result:
-- !result
UPDATE t SET v1 = 100 where id = 1;
-- result:
-- !result
SELECT * FROM t;
-- result:
1	100	3	3
-- !result
UPDATE t SET v1 = 200 where v3 = 3;
-- result:
-- !result
SELECT * FROM t;
-- result:
1	200	3	3
-- !result
UPDATE t SET v2 = 300 where v3 = 3;
-- result:
-- !result
SELECT * FROM t;
-- result:
1	200	300	300
-- !result
UPDATE t SET v2 = 400 where v3 = 300;
-- result:
-- !result
SELECT * FROM t;
-- result:
1	200	400	400
-- !result
INSERT INTO t VALUES (1, 2, 3);
-- result:
-- !result
SET partial_update_mode = "column";
-- result:
-- !result
UPDATE t SET v1 = 100 where id = 1;
-- result:
E: (1064, 'Getting analyzing error. Detail message: All ref Column must be sepecfied in partial update mode.')
-- !result
SELECT * FROM t;
-- result:
1	2	3	3
-- !result
UPDATE t SET v1 = 200 where v3 = 3;
-- result:
E: (1064, 'Getting analyzing error. Detail message: All ref Column must be sepecfied in partial update mode.')
-- !result
SELECT * FROM t;
-- result:
1	2	3	3
-- !result
UPDATE t SET v2 = 300 where v3 = 3;
-- result:
-- !result
SELECT * FROM t;
-- result:
1	2	300	300
-- !result
UPDATE t SET v2 = 400 where v3 = 300;
-- result:
-- !result
SELECT * FROM t;
-- result:
1	2	400	400
-- !result
DROP DATABASE test_update;
-- result:
-- !result