-- name: test_range_orderby_add_index @cloud
set enable_range_distribution = true;
-- result:
-- !result
create database db_${uuid0};
-- result:
-- !result
use db_${uuid0};
-- result:
-- !result
create table t (
    k1 int not null,
    k2 int not null,
    v1 int not null,
    v2 varchar(32) not null,
    c1 int not null,
    c2 int not null
)
primary key(k1, k2)
order by(v1, v2)
properties('replication_num' = '1');
-- result:
-- !result
insert into t
select x, x % 7, 100000 - x, concat('p', x), x % 10, x
from table(generate_series(1, 2000)) as g(x);
-- result:
-- !result
select count(*), count(distinct c1) from t;
-- result:
2000	10
-- !result
alter table t add index idx_c1 (c1) using bitmap;
-- result:
-- !result
function: wait_alter_table_finish()
-- result:
None
-- !result
show index from t;
-- result:
[REGEX].*idx_c1.*BITMAP.*
-- !result
select count(*), count(distinct c1) from t;
-- result:
2000	10
-- !result
select count(*) from t where c1 = 3;
-- result:
200
-- !result
select k1, k2, c1 from t where c1 = 0 and k1 <= 20 order by k1;
-- result:
10	3	0
20	6	0
-- !result
insert into t values (2001, 1, 1, 'new', 3, 2001);
-- result:
-- !result
select count(*) from t where c1 = 3;
-- result:
201
-- !result
delete from t where k1 = 2001;
-- result:
-- !result
select count(*) from t where c1 = 3;
-- result:
200
-- !result
drop index idx_c1 on t;
-- result:
-- !result
function: wait_alter_table_finish()
-- result:
None
-- !result
show index from t;
-- result:
-- !result
select count(*) from t where c1 = 3;
-- result:
200
-- !result
drop database db_${uuid0} force;
-- result:
-- !result

-- name: test_range_orderby_add_index_after_split @cloud @sequential
set enable_range_distribution = true;
-- result:
-- !result
create database db_${uuid0};
-- result:
-- !result
use db_${uuid0};
-- result:
-- !result
create table t (
    k1 int not null,
    k2 int not null,
    v1 int not null,
    v2 varchar(256) not null,
    c1 int not null,
    c2 int not null
)
primary key(k1, k2)
order by(v1, v2)
properties('replication_num' = '1');
-- result:
-- !result
insert into t
select x, x % 7, 100000 - x, repeat(md5(cast(x as varchar)), 6), x % 10, x
from table(generate_series(1, 20000)) as g(x);
-- result:
-- !result
[UC]alter table t split tablet properties('tablet_reshard_target_size' = '1024');
shell: n=1; for i in $(seq 1 55); do n=$(${mysql_cmd} -Ne "select count(1) from information_schema.tablet_reshard_jobs where db_name='db_${uuid0}' and job_state not in ('FINISHED','ABORTED')" 2>/dev/null); [ "$n" = "0" ] && break; sleep 2; done; echo "pending=$n"
-- result:
0
pending=0
-- !result
select buckets > 1 as did_split from information_schema.partitions_meta
    where db_name = 'db_${uuid0}' and table_name = 't';
-- result:
1
-- !result
alter table t add index idx_c1 (c1) using bitmap;
-- result:
-- !result
function: wait_alter_table_finish()
-- result:
None
-- !result
select count(*), count(distinct c1) from t;
-- result:
20000	10
-- !result
select count(*) from t where c1 = 3;
-- result:
2000
-- !result
select count(*) from t where c1 = 3 and v1 > 99000;
-- result:
100
-- !result
insert into t values (999999, 1, 1, 'tail', 3, 999999);
-- result:
-- !result
select count(*) from t where c1 = 3;
-- result:
2001
-- !result
select k1, k2, v1, c1 from t where k1 = 999999;
-- result:
999999	1	1	3
-- !result
delete from t where k1 = 999999;
-- result:
-- !result
select count(*) from t where c1 = 3;
-- result:
2000
-- !result
select count(*) from t;
-- result:
20000
-- !result
drop index idx_c1 on t;
-- result:
-- !result
function: wait_alter_table_finish()
-- result:
None
-- !result
select count(*) from t where c1 = 3;
-- result:
2000
-- !result
drop database db_${uuid0} force;
-- result:
-- !result