-- name: test_flexible_partial_update_disabled @cloud @sequential
create database test_flex_pu_off_${uuid0};
-- result:
-- !result
use test_flex_pu_off_${uuid0};
-- result:
-- !result
CREATE TABLE t (pk BIGINT NOT NULL, c1 BIGINT, c2 BIGINT, c3 BIGINT DEFAULT "7")
PRIMARY KEY(pk) DISTRIBUTED BY HASH(pk) BUCKETS 1 PROPERTIES("replication_num" = "1");
-- result:
-- !result
shell: curl --location-trusted -u root: -X PUT -H "Expect:100-continue" -H "column_separator:," -H "columns:pk,c1,c2,c3" -T ${root_path}/lib/../common/data/stream_load/flexible_partial_update_base.csv ${url}/api/test_flex_pu_off_${uuid0}/t/_stream_load
-- result:
0
{
    "Status": "Success",
    "Message": "OK"
}
-- !result
sync;
-- result:
-- !result
shell: curl --location-trusted -u root: -X PUT -H "Expect:100-continue" -H "format:json" -H "strip_outer_array:true" -H "partial_update:true" -H "partial_update_mode:flexible_row" -H "columns:pk,c1,c2,c3,__op" -T ${root_path}/lib/../common/data/stream_load/flexible_partial_update.json ${url}/api/test_flex_pu_off_${uuid0}/t/_stream_load
-- result:
0
{
    "Status": "Fail",
    "Message": "partial_update_mode=flexible_row requires enable_flexible_partial_update to be enabled on the BE and the FE"
}
-- !result
update information_schema.be_configs set value = "true" where name = "enable_flexible_partial_update";
-- result:
-- !result
shell: curl --location-trusted -u root: -X PUT -H "Expect:100-continue" -H "format:json" -H "strip_outer_array:true" -H "partial_update:true" -H "partial_update_mode:flexible_row" -H "columns:pk,c1,c2,c3,__op" -T ${root_path}/lib/../common/data/stream_load/flexible_partial_update.json ${url}/api/test_flex_pu_off_${uuid0}/t/_stream_load
-- result:
0
{
    "Status": "Fail",
    "Message": "Flexible partial update (partial_update_mode=flexible_row) requires enable_flexible_partial_update to be enabled on the FE and the BE"
}
-- !result
update information_schema.be_configs set value = "false" where name = "enable_flexible_partial_update";
-- result:
-- !result
shell: curl --location-trusted -u root: -X PUT -H "Expect:100-continue" -H "column_separator:," -H "partial_update:true" -H "partial_update_mode:column" -H "columns:pk,c1" -T ${root_path}/lib/../common/data/stream_load/flexible_partial_update_one.csv ${url}/api/test_flex_pu_off_${uuid0}/t/_stream_load
-- result:
0
{
    "Status": "Success",
    "Message": "OK"
}
-- !result
sync;
-- result:
-- !result
select * from t order by pk;
-- result:
1	999	10	10
2	20	20	20
3	30	30	30
4	40	40	40
5	50	50	50
-- !result
drop database test_flex_pu_off_${uuid0} force;
-- result:
-- !result
-- name: test_flexible_partial_update @cloud @sequential
create database test_flex_pu_${uuid0};
-- result:
-- !result
use test_flex_pu_${uuid0};
-- result:
-- !result
admin set frontend config ("enable_flexible_partial_update" = "true");
-- result:
-- !result
update information_schema.be_configs set value = "true" where name = "enable_flexible_partial_update";
-- result:
-- !result
CREATE TABLE t_row (pk BIGINT NOT NULL, c1 BIGINT, c2 BIGINT, c3 BIGINT DEFAULT "7")
PRIMARY KEY(pk) DISTRIBUTED BY HASH(pk) BUCKETS 1 PROPERTIES("replication_num" = "1");
-- result:
-- !result
shell: curl --location-trusted -u root: -X PUT -H "Expect:100-continue" -H "column_separator:," -H "columns:pk,c1,c2,c3" -T ${root_path}/lib/../common/data/stream_load/flexible_partial_update_base.csv ${url}/api/test_flex_pu_${uuid0}/t_row/_stream_load
-- result:
0
{
    "Status": "Success",
    "Message": "OK"
}
-- !result
sync;
-- result:
-- !result
shell: curl --location-trusted -u root: -X PUT -H "Expect:100-continue" -H "format:json" -H "strip_outer_array:true" -H "partial_update:true" -H "partial_update_mode:flexible_row" -H "columns:pk,c1,c2,c3,__op" -T ${root_path}/lib/../common/data/stream_load/flexible_partial_update.json ${url}/api/test_flex_pu_${uuid0}/t_row/_stream_load
-- result:
0
{
    "Status": "Success",
    "Message": "OK"
}
-- !result
sync;
-- result:
-- !result
select * from t_row order by pk;
-- result:
1	999	10	10
2	20	888	None
3	777	30	777
5	50	50	50
6	None	666	7
7	None	None	7
-- !result
shell: curl --location-trusted -u root: -X PUT -H "Expect:100-continue" -H "format:json" -H "strip_outer_array:true" -H "partial_update:true" -H "partial_update_mode:flexible_row" -H "columns:pk,c1,c2,c3" -T ${root_path}/lib/../common/data/stream_load/flexible_partial_update_second.json ${url}/api/test_flex_pu_${uuid0}/t_row/_stream_load
-- result:
0
{
    "Status": "Success",
    "Message": "OK"
}
-- !result
sync;
-- result:
-- !result
select * from t_row order by pk;
-- result:
1	999	111	10
2	20	888	None
3	777	30	777
5	50	50	50
6	61	666	7
7	None	None	7
-- !result
admin set frontend config ("enable_flexible_partial_update" = "false");
-- result:
-- !result
update information_schema.be_configs set value = "false" where name = "enable_flexible_partial_update";
-- result:
-- !result
drop database test_flex_pu_${uuid0} force;
-- result:
-- !result
-- name: test_flexible_partial_update_rejected @cloud @sequential
create database test_flex_pu_reject_${uuid0};
-- result:
-- !result
use test_flex_pu_reject_${uuid0};
-- result:
-- !result
admin set frontend config ("enable_flexible_partial_update" = "true");
-- result:
-- !result
update information_schema.be_configs set value = "true" where name = "enable_flexible_partial_update";
-- result:
-- !result
CREATE TABLE t (pk BIGINT NOT NULL, c1 BIGINT, c2 BIGINT, c3 BIGINT)
PRIMARY KEY(pk) DISTRIBUTED BY HASH(pk) BUCKETS 1 PROPERTIES("replication_num" = "1");
-- result:
-- !result
CREATE TABLE t_ai (pk BIGINT NOT NULL, ai BIGINT NOT NULL AUTO_INCREMENT, c1 BIGINT, c2 BIGINT)
PRIMARY KEY(pk) DISTRIBUTED BY HASH(pk) BUCKETS 1 PROPERTIES("replication_num" = "1");
-- result:
-- !result
CREATE TABLE t_sk (pk BIGINT NOT NULL, c1 BIGINT, c2 BIGINT, c3 BIGINT)
PRIMARY KEY(pk) DISTRIBUTED BY HASH(pk) BUCKETS 1 ORDER BY (c1) PROPERTIES("replication_num" = "1");
-- result:
-- !result
shell: curl --location-trusted -u root: -X PUT -H "Expect:100-continue" -H "format:json" -H "strip_outer_array:true" -H "partial_update:true" -H "partial_update_mode:flexible_row" -H "merge_condition:c1" -H "columns:pk,c1,c2,c3" -T ${root_path}/lib/../common/data/stream_load/flexible_partial_update_one.json ${url}/api/test_flex_pu_reject_${uuid0}/t/_stream_load
-- result:
0
{
    "Status": "Fail",
    "Message": "Flexible partial update combined with merge_condition is not supported"
}
-- !result
shell: curl --location-trusted -u root: -X PUT -H "Expect:100-continue" -H "format:json" -H "strip_outer_array:true" -H "partial_update:true" -H "partial_update_mode:flexible_row" -H "columns:pk,c1,c2=c1+1" -T ${root_path}/lib/../common/data/stream_load/flexible_partial_update_one.json ${url}/api/test_flex_pu_reject_${uuid0}/t/_stream_load
-- result:
0
{
    "Status": "Fail",
    "Message": "Flexible partial update does not support column mappings or expressions (column 'c2'): a row's column set is derived from the columns present in that row, so a derived column would never be applied"
}
-- !result
shell: curl --location-trusted -u root: -X PUT -H "Expect:100-continue" -H "column_separator:," -H "partial_update:true" -H "partial_update_mode:flexible_row" -H "columns:pk,c1" -T ${root_path}/lib/../common/data/stream_load/flexible_partial_update_one.csv ${url}/api/test_flex_pu_reject_${uuid0}/t/_stream_load
-- result:
0
{
    "Status": "Fail",
    "Message": "flexible partial update is only supported for json format load"
}
-- !result
shell: curl --location-trusted -u root: -X PUT -H "Expect:100-continue" -H "format:json" -H "strip_outer_array:true" -H "partial_update_mode:flexible_row" -H "columns:pk,c1,c2,c3" -T ${root_path}/lib/../common/data/stream_load/flexible_partial_update_one.json ${url}/api/test_flex_pu_reject_${uuid0}/t/_stream_load
-- result:
0
{
    "Status": "Fail",
    "Message": "flexible partial update requires partial_update=true"
}
-- !result
shell: curl --location-trusted -u root: -X PUT -H "Expect:100-continue" -H "format:json" -H "strip_outer_array:true" -H "partial_update:true" -H "partial_update_mode:flexible_row" -H "columns:pk,c1,c2" -T ${root_path}/lib/../common/data/stream_load/flexible_partial_update_one.json ${url}/api/test_flex_pu_reject_${uuid0}/t_ai/_stream_load
-- result:
0
{
    "Status": "Fail",
    "Message": "Flexible partial update is not supported on a table with an auto-increment column"
}
-- !result
shell: curl --location-trusted -u root: -X PUT -H "Expect:100-continue" -H "format:json" -H "strip_outer_array:true" -H "partial_update:true" -H "partial_update_mode:flexible_row" -H "columns:pk,c1,c2,c3" -T ${root_path}/lib/../common/data/stream_load/flexible_partial_update_one.json ${url}/api/test_flex_pu_reject_${uuid0}/t_sk/_stream_load
-- result:
0
{
    "Status": "Fail",
    "Message": "Flexible partial update is not supported on a table whose sort key (ORDER BY) contains a non-primary-key column (column 'c1')"
}
-- !result
shell: curl --location-trusted -u root: -X PUT -H "Expect:100-continue" -H "format:json" -H "strip_outer_array:true" -H "partial_update:true" -H "partial_update_mode:flexible" -H "columns:pk,c1,c2,c3" -T ${root_path}/lib/../common/data/stream_load/flexible_partial_update_one.json ${url}/api/test_flex_pu_reject_${uuid0}/t/_stream_load
-- result:
0
{
    "Status": "Fail",
    "Message": "partial_update_mode=flexible (flexible partial update in column mode) is not supported yet; use partial_update_mode=flexible_row"
}
-- !result
select count(*) from t;
-- result:
0
-- !result
select count(*) from t_ai;
-- result:
0
-- !result
select count(*) from t_sk;
-- result:
0
-- !result
admin set frontend config ("enable_flexible_partial_update" = "false");
-- result:
-- !result
update information_schema.be_configs set value = "false" where name = "enable_flexible_partial_update";
-- result:
-- !result
drop database test_flex_pu_reject_${uuid0} force;
-- result:
-- !result
