-- name: test_table_sample @sequential @native
set pipeline_dop = 1;
-- result:
-- !result
create table t1 (
    k1 int,
    k2 int,
    k3 string
)
duplicate key(k1)
distributed by hash(k1) buckets 1
properties("replication_num" = "1");
-- result:
-- !result
insert into t1 
select s1, s1 % 1000, repeat('a', 128) FROM TABLE(generate_series(1, 655350)) s(s1);
-- result:
-- !result
create table pk_t1 primary key(k1) as select * from t1;
-- result:
-- !result
alter table t1 compact;
-- result:
-- !result
alter table pk_t1 compact;
-- result:
-- !result
select sleep(3);
-- result:
1
-- !result
select count(k1), sum(k1), sum(k2) from t1 sample('method'='by_nothing');
-- result:
E: (1064, 'Getting syntax error from line 1, column 43 to line 1, column 71. Detail message: unrecognized sample-method: by_nothing.')
-- !result
select count(k1), sum(k1), sum(k2) from t1 sample('percent'='1111');
-- result:
E: (1064, 'Getting syntax error from line 1, column 43 to line 1, column 66. Detail message: invalid percent which should in (0, 100).')
-- !result
select count(k1), sum(k1), sum(k2) from t1 sample('percent'='0');
-- result:
E: (1064, 'Getting syntax error from line 1, column 43 to line 1, column 63. Detail message: invalid percent which should in (0, 100).')
-- !result
select count(k1), sum(k1), sum(k2) from t1 sample('unknown'='a');
-- result:
E: (1064, 'Getting syntax error from line 1, column 43 to line 1, column 63. Detail message: unrecognized property: unknown.')
-- !result
[UC] select count(k1), sum(k1), sum(k2) from t1 sample;
-- result:
7168	2461535744	3552744
-- !result
select count(k1), sum(k1), sum(k2) from t1 sample('seed'='1', 'method'='by_block', 'percent'='1');
-- result:
6144	1574964224	3070224
-- !result
select count(k1), sum(k1), sum(k2) from t1 sample('seed'='1', 'method'='by_block', 'percent'='10');
-- result:
77824	24392013824	38863824
-- !result
select count(k1), sum(k1), sum(k2) from t1 sample('seed'='123', 'method'='by_block', 'percent'='10');
-- result:
60416	19257652736	30185736
-- !result
delete from t1 where k2 = 1;
-- result:
-- !result
select count(k1), sum(k1), sum(k2) from t1 sample('seed'='1', 'method'='by_block', 'percent'='1');
-- result:
6138	1573426218	3070218
-- !result
select count(k1), sum(k1), sum(k2) from t1 sample('seed'='1', 'method'='by_block', 'percent'='10');
-- result:
77746	24367723746	38863746
-- !result
select count(k1), sum(k1), sum(k2) 
from t1 sample('seed'='1', 'method'='by_block', 'percent'='1')
where k2 = 2;
-- result:
6	1538012	12
-- !result
select count(k1), sum(k1), sum(k2) from pk_t1 sample('seed'='1', 'method'='by_block', 'percent'='10');
-- result:
49152	24024997888	24748888
-- !result
select count(k1) > 0 from t1 sample('seed'='1', 'method'='by_block', 'percent'='0.5');
-- result:
1
-- !result
select count(k1) > 0 from t1 sample('seed'='1', 'method'='by_block', 'percent'='0.01');
-- result:
1
-- !result
select count(k1) > 0 from t1 sample('seed'='1', 'method'='by_block', 'percent'='0.001');
-- result:
1
-- !result
select count(k1) > 0 from t1 sample('seed'='1', 'method'='by_block', 'percent'='1.5');
-- result:
1
-- !result
select count(k1) > 0 from pk_t1 sample('seed'='1', 'method'='by_block', 'percent'='0.5');
-- result:
1
-- !result
create table t1_page (k1 int) duplicate key(k1) distributed by hash(k1) buckets 1 properties("replication_num" = "1");
-- result:
-- !result
insert into t1_page select s1 from table(generate_series(1, 655350)) s(s1);
-- result:
-- !result
alter table t1_page compact;
-- result:
-- !result
select count(k1) > 0 from t1_page sample('seed'='1', 'method'='by_page', 'percent'='0.5');
-- result:
1
-- !result
select count(k1) > 0 from t1_page sample('seed'='1', 'method'='by_page', 'percent'='0.01');
-- result:
1
-- !result
select count(k1) > 0 from t1_page sample('seed'='1', 'method'='by_page', 'percent'='1.5');
-- result:
1
-- !result

-- name: test_table_sample_by_page_column_without_reader
create database db_${uuid0};
-- result:
-- !result
use db_${uuid0};
-- result:
-- !result
create table tj (k int not null, j json)
duplicate key(k)
distributed by hash(k) buckets 1
properties("replication_num" = "1", "flat_json.enable" = "true");
-- result:
-- !result
insert into tj select s1, parse_json(concat('{"a":', s1, ',"b":"s"}')) from table(generate_series(1, 2000)) s(s1);
-- result:
-- !result
insert into tj select s1, parse_json(concat('{"a":', s1, ',"b":"s"}')) from table(generate_series(1, 2000)) s(s1);
-- result:
-- !result
select flat_json_meta(j) from tj[_META_];
-- result:
["nulls(TINYINT), a(BIGINT), b(VARCHAR)"]
-- !result
select count(j) from tj sample('seed'='1', 'method'='by_page');
-- result:
[REGEX].*Not support page sample: no column_reader.*
-- !result
create table t (k int not null, c1 int, s char(10))
duplicate key(k)
distributed by hash(k) buckets 1
properties("replication_num" = "1");
-- result:
-- !result
insert into t select s1, s1, 'abc' from table(generate_series(1, 2000)) s(s1);
-- result:
-- !result
insert into t select s1, s1, 'abc' from table(generate_series(1, 2000)) s(s1);
-- result:
-- !result
alter table t add column w int default "7";
-- result:
-- !result
function: wait_alter_table_finish()
-- result:
None
-- !result
select count(w) from t sample('seed'='1', 'method'='by_page');
-- result:
[REGEX].*Not support page sample: no column_reader.*
-- !result
alter table t modify column s char(30);
-- result:
-- !result
function: wait_alter_table_finish()
-- result:
None
-- !result
[UC] select count(s) from t sample('seed'='1', 'method'='by_page');
select count(k) > 0 from tj sample('seed'='1', 'method'='by_page');
-- result:
1
-- !result
select count(cast(j->'$.a' as bigint)) > 0 from tj sample('seed'='1', 'method'='by_page');
-- result:
1
-- !result
select count(c1) > 0 from t sample('seed'='1', 'method'='by_page');
-- result:
1
-- !result
select count(j) > 0 from tj sample('seed'='1', 'method'='by_block');
-- result:
1
-- !result
select count(w) > 0 from t sample('seed'='1', 'method'='by_block');
-- result:
1
-- !result
select count(*) from tj;
-- result:
4000
-- !result
select count(*) from t;
-- result:
4000
-- !result
drop database db_${uuid0};
-- result:
-- !result
